Year,Rnd,DT,OvPck,FrRnd,RdPck,Tm,Signed,Bonus,Name,Pos,WAR,G,AB,HR,BA,OPS,G.1,W,L,ERA,WHIP,SV,Type,Drafted Out of,Team Made Playoffs
2004,1,,11,FrRnd,11,Pirates,Y,"$1,950,000 ",Neil Walker(minors),C,19.6,1306.0,4583.0,149.0,0.267,0.764,1.0,0.0,0.0,0.0,1.5,0.0,HS,"Pine-Richland HS (Gibsonia, PA)",0
2004,1,,12,FrRnd,12,Angels,Y,"$4,000,000 ",Jered Weaver(minors),RHP,34.6,28.0,55.0,0.0,0.073,0.178,331.0,150.0,98.0,3.63,1.19,0.0,4Yr,"California State University, Long Beach (Long Beach, CA)",1
2004,1,,13,FrRnd,13,Expos,Y,"$1,750,000 ",Bill Bray(minors),LHP,2.3,243.0,1.0,0.0,0.0,0.0,258.0,13.0,12.0,3.74,1.38,3.0,4Yr,"College of William and Mary (Williamsburg, VA)",0
2004,1,,14,FrRnd,14,Royals,Y,"$1,450,000 ",Billy Butler(minors),3B,11.9,1414.0,5105.0,147.0,0.29,0.795,,,,,,,HS,"Wolfson HS (Jacksonville, FL)",0
2004,1,,15,FrRnd,15,Diamondbacks,Y,"$4,000,000 ",Stephen Drew(minors),SS,15.9,1268.0,4403.0,123.0,0.252,0.741,,,,,,,4Yr,"Florida State University (Tallahassee, FL)",0
2004,1,,16,FrRnd,16,Blue Jays,Y,"$1,600,000 ",David Purcey(minors),LHP,0.1,7.0,1.0,0.0,0.0,0.0,111.0,7.0,13.0,4.98,1.54,1.0,4Yr,"University of Oklahoma (Norman, OK)",0
2004,1,,17,FrRnd,17,Dodgers,Y,"$1,575,000 ",Scott Elbert(minors),LHP,1.5,120.0,6.0,0.0,0.167,0.5,127.0,4.0,3.0,3.54,1.33,2.0,HS,"Seneca HS (Seneca, MO)",1
2004,1,,18,FrRnd,18,White Sox,Y,"$1,550,000 ",Josh Fields(minors),3B,-1.1,217.0,713.0,34.0,0.234,0.724,,,,,,,4Yr,"Oklahoma State University (Stillwater, OK)",0
2004,1,,19,FrRnd,19,Cardinals,Y,"$1,525,000 ",Chris Lambert(minors),RHP,-0.8,0.0,0.0,0.0,,,14.0,1.0,3.0,7.36,1.97,0.0,4Yr,"Boston College (Chestnut Hill, MA)",1
2004,1,,20,FrRnd,20,Twins,Y,"$1,500,000 ",Trevor Plouffe(minors),SS,7.3,830.0,2933.0,106.0,0.242,0.714,,,,,,,HS,"Crespi Carmelite HS (Encino, CA)",1
2004,1,,21,FrRnd,21,Phillies,Y,"$1,475,000 ",Greg Golson(minors),OF,-0.6,40.0,41.0,0.0,0.195,0.458,,,,,,,HS,"John B. Connally HS (Austin, TX)",0
2004,1,,22,FrRnd,22,Twins via Mariners,Y,"$1,425,000 ",*Glen Perkins(minors),LHP,8.9,24.0,4.0,0.0,0.0,0.0,409.0,35.0,25.0,3.88,1.29,120.0,4Yr,"University of Minnesota (Minneapolis, MN)",1
2004,1,,23,FrRnd,23,Yankees via Astros,Y,"$1,400,000 ",*Phil Hughes(minors),RHP,11.0,32.0,18.0,0.0,0.0,0.0,290.0,88.0,79.0,4.52,1.31,3.0,HS,"Foothill HS (Santa Ana, CA)",1
2004,1,,24,FrRnd,24,Athletics via Red Sox,Y,"$1,000,000 ",*Landon Powell(minors),C,0.2,123.0,363.0,10.0,0.207,0.612,,,,,,,4Yr,"University of South Carolina (Columbia, SC)",0
2004,1,,25,FrRnd,25,Twins via Cubs,Y,"$1,000,000 ",*Kyle Waldrop(minors),RHP,0.5,0.0,0.0,0.0,,,24.0,1.0,1.0,3.62,1.52,0.0,HS,"Farragut HS (Knoxville, TN)",1
2004,1,,26,FrRnd,26,Athletics,Y,"$1,325,000 ",Richie Robnett(minors),OF,,,,,,,,,,,,,4Yr,"California State University, Fresno (Fresno, CA)",0
2004,1,,27,FrRnd,27,Marlins,Y,"$1,300,000 ",Taylor Tankersley(minors),LHP,0.6,160.0,2.0,0.0,0.0,0.0,168.0,8.0,3.0,4.58,1.52,4.0,4Yr,"University of Alabama (Tuscaloosa, AL)",0
2004,1,,28,FrRnd,28,Dodgers via Yankees,Y,"$1,200,000 ",*Blake DeWitt(minors),2B,1.9,426.0,1119.0,21.0,0.257,0.705,,,,,,,HS,"Sikeston HS (Sikeston, MO)",1
2004,1,,29,FrRnd,29,Royals via Giants,Y,"$1,100,000 ",*Matt Campbell(minors),lHP,,,,,,,,,,,,,4Yr,"University of South Carolina (Columbia, SC)",0
2004,1,,30,FrRnd,30,Rangers via Braves,Y,"$1,050,000 ",*Eric Hurley(minors),RHP,0.1,1.0,2.0,0.0,0.5,1.0,5.0,1.0,2.0,5.47,1.42,0.0,HS,"Wolfson HS (Jacksonville, FL)",0
2004,1s,,31,FrRnd,31,Royals,Y,"$1,000,000 ",*J.P. Howell(minors),LHP,7.8,273.0,13.0,0.0,0.154,0.308,547.0,36.0,30.0,3.83,1.34,22.0,4Yr,"University of Texas at Austin (Austin, TX)",0
2004,1s,,32,FrRnd,32,Blue Jays,Y,"$1,017,500 ",*Zach Jackson(minors),LHP,-0.8,8.0,9.0,0.0,0.111,0.222,22.0,4.0,5.0,5.81,1.57,0.0,4Yr,"Texas A&M University (College Station, TX)",0
2004,1s,,33,FrRnd,33,Dodgers,Y,"$1,000,000 ",*Justin Orenduff(minors),RHP,,,,,,,,,,,,,4Yr,"Virginia Commonwealth University (Richmond, VA)",1
2004,1s,,34,FrRnd,34,White Sox,Y,"$975,000 ",*Tyler Lumsden(minors),LHP,,,,,,,,,,,,,4Yr,"Clemson University (Clemson, SC)",0
2004,1s,,35,FrRnd,35,Twins,Y,"$950,000 ",*Matt Fox(minors),RHP,0.0,0.0,0.0,0.0,,,4.0,0.0,0.0,4.91,1.36,0.0,4Yr,"University of Central Florida (Orlando, FL)",1
2004,1s,,36,FrRnd,36,Athletics,Y,"$950,000 ",*Danny Putnam(minors),OF,-0.2,11.0,28.0,1.0,0.214,0.612,,,,,,,4Yr,"Stanford University (Palo Alto, CA)",0
2004,1s,,37,FrRnd,37,Yankees,Y,"$925,000 ",*Jon Poterson(minors),C,,,,,,,,,,,,,HS,"Chandler HS (Chandler, AZ)",1
2004,1s,,38,FrRnd,38,White Sox,Y,"$850,000 ",*Gio Gonzalez(minors),lHP,28.3,221.0,410.0,3.0,0.09,0.247,344.0,131.0,101.0,3.7,1.32,0.0,HS,"Monsignor Edward Pace HS (Miami Gardens, FL)",0
2004,1s,,39,FrRnd,39,Twins,Y,"$875,000 ",*Jay Rainville(minors),RHP,,,,,,,,,,,,,HS,"Bishop Hendricken HS (Warwick, RI)",1
2004,1s,,40,FrRnd,40,Athletics,Y,"$800,000 ",*Huston Street(minors),RHP,14.5,304.0,2.0,0.0,0.0,0.0,668.0,42.0,34.0,2.95,1.07,324.0,4Yr,"University of Texas at Austin (Austin, TX)",0
2004,1s,,41,FrRnd,41,Yankees,Y,"$790,000 ",*Jeff Marquez(minors),RHP,0.0,1.0,0.0,0.0,,,4.0,0.0,0.0,5.4,1.4,0.0,JC,"Sacramento City College (Sacramento, CA)",1
2005,1,,1,FrRnd,1,Diamondbacks,Y,"$6,100,000 ",Justin Upton(minors),SS,32.3,1842.0,6714.0,325.0,0.261,0.812,,,,,,,HS,"Great Bridge HS (Chesapeake, VA)",0
2005,1,,2,FrRnd,2,Royals,Y,"$4,000,000 ",Alex Gordon(minors),3B,34.4,1753.0,6391.0,190.0,0.257,0.749,2.0,0.0,0.0,19.29,4.29,0.0,4Yr,"University of Nebraska-Lincoln (Lincoln, NE)",0
2005,1,,3,FrRnd,3,Mariners,Y,"$3,400,000 ",Jeff Clement(minors),C,-1.2,152.0,385.0,14.0,0.218,0.648,,,,,,,4Yr,"University of Southern California (Los Angeles, CA)",0
2005,1,,4,FrRnd,4,Nationals,Y,"$2,975,000 ",Ryan Zimmerman(minors),3B,40.1,1799.0,6654.0,284.0,0.277,0.816,,,,,,,4Yr,"University of Virginia (Charlottesville, VA)",0
2005,1,,5,FrRnd,5,Brewers,Y,"$2,450,000 ",Ryan Braun(minors),3B,47.1,1766.0,6622.0,352.0,0.296,0.891,,,,,,,4Yr,"University of Miami (Coral Gables, FL)",0
2005,1,,6,FrRnd,6,Blue Jays,Y,"$2,400,000 ",Ricky Romero(minors),LHP,9.9,8.0,21.0,0.0,0.095,0.19,129.0,51.0,45.0,4.16,1.4,0.0,4Yr,"California State University, Fullerton (Fullerton, CA)",0
2005,1,,7,FrRnd,7,Rockies,Y,"$2,300,000 ",Troy Tulowitzki(minors),SS,44.5,1291.0,4804.0,225.0,0.29,0.856,,,,,,,4Yr,"California State University, Long Beach (Long Beach, CA)",0
2005,1,,8,FrRnd,8,Devil Rays,Y,"$1,500,000 ",Wade Townsend(minors),RHP,,,,,,,,,,,,,4Yr,"Rice University (Houston, TX)",0
2005,1,,9,FrRnd,9,Mets,Y,"$3,550,000 ",Mike Pelfrey(minors),RHP,5.8,148.0,268.0,0.0,0.105,0.275,275.0,68.0,103.0,4.68,1.51,1.0,4Yr,"Wichita State University (Wichita, KS)",0
2005,1,,10,FrRnd,10,Tigers,Y,"$2,650,000 ",Cameron Maybin(minors),OF,13.5,1162.0,3824.0,72.0,0.254,0.697,,,,,,,HS,"T. C. Roberson HS (Asheville, NC)",0
2005,1,,11,FrRnd,11,Pirates,Y,"$1,900,000 ",Andrew McCutchen(minors),OF,46.1,1828.0,6786.0,277.0,0.279,0.843,,,,,,,HS,"Fort Meade HS (Fort Meade, FL)",0
2005,1,,12,FrRnd,12,Reds,Y,"$1,800,000 ",Jay Bruce(minors),OF,19.9,1650.0,5964.0,319.0,0.244,0.781,,,,,,,HS,"West Brook HS (Beaumont, TX)",0
2005,1,,13,FrRnd,13,Orioles,Y,"$1,700,000 ",Brandon Snyder(minors),C,-0.1,122.0,200.0,9.0,0.24,0.731,,,,,,,HS,"Westfield HS (Chantilly, VA)",0
2005,1,,14,FrRnd,14,Indians,Y,"$1,695,000 ",Trevor Crowe(minors),OF,0.2,265.0,818.0,4.0,0.24,0.615,,,,,,,4Yr,"University of Arizona (Tucson, AZ)",0
2005,1,,15,FrRnd,15,White Sox,Y,"$1,570,000 ",Lance Broadway(minors),RHP,0.3,8.0,0.0,0.0,,,27.0,2.0,2.0,5.24,1.6,0.0,4Yr,"Texas Christian University (Fort Worth, TX)",1
2005,1,,16,FrRnd,16,Marlins,Y,"$1,600,000 ",Chris Volstad(minors),RHP,2.0,130.0,201.0,0.0,0.139,0.317,170.0,37.0,58.0,5.0,1.45,0.0,HS,"Palm Beach Gardens HS (Palm Beach Gardens, FL)",0
2005,1,,17,FrRnd,17,Yankees via Phillies,Y,"$1,575,000 ",*C.J. Henry(minors),SS,,,,,,,,,,,,,HS,"Putnam City HS (Oklahoma City, OK)",1
2005,1,,18,FrRnd,18,Padres,Y,"$1,550,000 ",Cesar Carrillo(minors),RHP,-0.7,3.0,3.0,0.0,0.0,0.0,3.0,1.0,2.0,13.06,2.71,0.0,4Yr,"University of Miami (Coral Gables, FL)",1
2005,1,,19,FrRnd,19,Rangers,Y,"$1,525,000 ",John Mayberry(minors),OF,1.5,574.0,1386.0,56.0,0.235,0.72,,,,,,,4Yr,"Stanford University (Palo Alto, CA)",0
2005,1,,20,FrRnd,20,Cubs,Y,"$1,750,000 ",Mark Pawelek(minors),LHP,,,,,,,,,,,,,HS,"Springville HS (Springville, UT)",0
2005,1,,21,FrRnd,21,Athletics,Y,"$1,475,000 ",Cliff Pennington(minors),SS,10.1,971.0,2799.0,36.0,0.242,0.648,1.0,0.0,0.0,9.0,3.0,0.0,4Yr,"Texas A&M University (College Station, TX)",0
2005,1,,22,FrRnd,22,Marlins via Giants,Y,"$1,225,000 ",*Aaron Thompson(minors),LHP,-0.1,10.0,0.0,0.0,,,52.0,1.0,3.0,4.94,1.52,0.0,HS,"Second Baptist School (Houston, TX)",0
2005,1,,23,FrRnd,23,Red Sox via Angels,Y,"$1,400,000 ",*Jacoby Ellsbury(minors),OF,31.2,1235.0,4846.0,104.0,0.284,0.76,,,,,,,4Yr,"Oregon State University (Corvallis, OR)",1
2005,1,,24,FrRnd,24,Astros,Y,"$1,375,000 ",Brian Bogusevic(minors),LHP,2.1,321.0,748.0,19.0,0.238,0.684,1.0,0.0,0.0,18.0,3.0,0.0,4Yr,"Tulane University (New Orleans, LA)",1
2005,1,,25,FrRnd,25,Twins,Y,"$1,350,000 ",Matt Garza(minors),RHP,12.5,152.0,274.0,0.0,0.08,0.201,290.0,93.0,106.0,4.09,1.32,1.0,4Yr,"California State University, Fresno (Fresno, CA)",0
2005,1,,26,FrRnd,26,Red Sox via Dodgers,Y,"$1,325,000 ",*Craig Hansen(minors),RHP,-1.9,27.0,0.0,0.0,,,95.0,4.0,9.0,6.34,1.72,3.0,4Yr,"St. John's University (Queens, NY)",1
2005,1,,27,FrRnd,27,Braves,Y,"$1,300,000 ",Joey Devine(minors),RHP,2.0,30.0,1.0,0.0,0.0,0.0,93.0,8.0,3.0,2.75,1.25,1.0,4Yr,"North Carolina State University (Raleigh, NC)",1
2005,1,,28,FrRnd,28,Cardinals via Red Sox,Y,"$1,000,000 ",*Colby Rasmus(minors),OF,20.2,1092.0,3704.0,166.0,0.241,0.745,,,,,,,HS,"Russell County HS (Seale, AL)",1
2005,1,,29,FrRnd,29,Marlins via Yankees,Y,"$1,000,000 ",*Jacob Marceaux(minors),RHP,,,,,,,,,,,,,4Yr,"McNeese State University (Lake Charles, LA)",0
2005,1,,30,FrRnd,30,Cardinals,Y,"$1,100,000 ",Tyler Greene(minors),SS,-0.4,288.0,675.0,17.0,0.224,0.645,,,,,,,4Yr,"Georgia Institute of Technology (Atlanta, GA)",1
2005,1s,,31,FrRnd,31,Diamondbacks,Y,"$1,025,000 ",*Matt Torra(minors),RHP,,,,,,,,,,,,,4Yr,"University of Massachusetts Amherst (Amherst, MA)",0
2005,1s,,32,FrRnd,32,Rockies,Y,"$1,025,000 ",*Chaz Roe(minors),RHP,1.2,62.0,1.0,0.0,0.0,0.0,245.0,11.0,8.0,3.89,1.34,3.0,HS,"Lafayette HS (Lexington, KY)",0
2005,1s,,33,FrRnd,33,Indians,Y,"$1,000,000 ",*Johnny Drennen(minors),OF,,,,,,,,,,,,,HS,"Rancho Bernardo HS (San Diego, CA)",0
2005,1s,,34,FrRnd,34,Marlins,Y,"$975,000 ",*Ryan Tucker(minors),RHP,-1.3,11.0,7.0,0.0,0.0,0.0,18.0,2.0,3.0,8.14,1.88,0.0,HS,"Temple City HS (Temple City, CA)",0
2005,1s,,35,FrRnd,35,Padres,Y,"$950,000 ",*Cesar Ramos(minors),LHP,1.4,43.0,6.0,0.0,0.0,0.0,267.0,10.0,15.0,4.02,1.4,2.0,4Yr,"California State University, Long Beach (Long Beach, CA)",1
2005,1s,,36,FrRnd,36,Athletics,Y,"$950,000 ",*Travis Buck(minors),OF,2.8,253.0,810.0,20.0,0.243,0.715,,,,,,,4Yr,"Arizona State University (Tempe, AZ)",0
2005,1s,,37,FrRnd,37,Angels,Y,"$925,000 ",*Trevor Bell(minors),RHP,-1.2,8.0,1.0,0.0,0.0,0.0,54.0,4.0,8.0,5.57,1.76,0.0,HS,"Crescenta Valley HS (La Crescenta, CA)",1
2005,1s,,38,FrRnd,38,Astros,Y,"$900,000 ",*Eli Iorg(minors),OF,,,,,,,,,,,,,4Yr,"University of Tennessee (Knoxville, TN)",1
2005,1s,,39,FrRnd,39,Twins,Y,"$900,000 ",*Hank Sanchez(minors),1B,,,,,,,,,,,,,HS,"Mission Bay HS (San Diego, CA)",0
2005,1s,,40,FrRnd,40,Dodgers,N,,*Luke Hochevar(minors),RHP,3.7,18.0,16.0,0.0,0.063,0.125,279.0,46.0,65.0,4.98,1.34,3.0,4Yr,"University of Tennessee (Knoxville, TN)",0
2005,1s,,41,FrRnd,41,Braves,Y,"$825,000 ",*Beau Jones(minors),LHP,,,,,,,,,,,,,HS,"Destrehan HS (Destrehan, LA)",1
2005,1s,,42,FrRnd,42,Red Sox,Y,"$800,000 ",*Clay Buchholz(minors),RHP,16.8,29.0,46.0,0.0,0.087,0.234,236.0,90.0,69.0,3.98,1.3,0.0,JC,"Angelina College (Lufkin, TX)",1
2005,1s,,43,FrRnd,43,Cardinals,Y,"$800,000 ",*Mark McCormick(minors),RHP,,,,,,,,,,,,,4Yr,"Baylor University (Waco, TX)",1
2005,1s,,44,FrRnd,44,Marlins,Y,"$775,000 ",*Sean West(minors),LHP,-0.1,21.0,34.0,0.0,0.059,0.147,22.0,8.0,8.0,5.03,1.58,0.0,HS,"Captain Shreve HS (Shreveport, LA)",0
2005,1s,,45,FrRnd,45,Red Sox,Y,"$762,000 ",*Jed Lowrie(minors),2B,16.0,1303.0,4599.0,121.0,0.257,0.737,,,,,,,4Yr,"Stanford University (Palo Alto, CA)",1
2005,1s,,46,FrRnd,46,Cardinals,Y,"$675,000 ",*Tyler Herron(minors),RHP,,,,,,,,,,,,,HS,"Wellington Community HS (Wellington, FL)",1
2005,1s,,47,FrRnd,47,Red Sox,Y,"$730,000 ",*Michael Bowden(minors),RHP,0.8,64.0,2.0,0.0,0.0,0.0,103.0,3.0,5.0,4.51,1.4,0.0,HS,"Waubonsie Valley HS (Aurora, IL)",1
2005,1s,,48,FrRnd,48,Orioles,Y,"$650,000 ",*Garrett Olson(minors),LHP,-2.7,11.0,6.0,0.0,0.167,0.31,104.0,14.0,22.0,6.26,1.67,1.0,4Yr,"California Polytechnic State University, San Luis Obispo (San Luis Obispo, CA)",0
2006,1,,1,FrRnd,1,Royals,Y,"$3,500,000 ",Luke Hochevar(minors),RHP,3.7,18.0,16.0,0.0,0.063,0.125,279.0,46.0,65.0,4.98,1.34,3.0,,,0
2006,1,,2,FrRnd,2,Rockies,Y,"$3,250,000 ",Greg Reynolds(minors),RHP,-1.5,31.0,30.0,0.0,0.167,0.46,33.0,6.0,11.0,7.01,1.65,0.0,4Yr,"Stanford University (Palo Alto, CA)",0
2006,1,,3,FrRnd,3,Devil Rays,Y,"$3,000,000 ",Evan Longoria(minors),3B,57.6,1866.0,6958.0,325.0,0.266,0.808,,,,,,,4Yr,"California State University, Long Beach (Long Beach, CA)",0
2006,1,,4,FrRnd,4,Pirates,Y,"$2,750,000 ",Brad Lincoln(minors),RHP,0.4,53.0,38.0,0.0,0.237,0.52,99.0,9.0,11.0,4.74,1.39,1.0,4Yr,"University of Houston (Houston, TX)",0
2006,1,,5,FrRnd,5,Mariners,Y,"$2,450,000 ",Brandon Morrow(minors),RHP,11.1,115.0,24.0,0.0,0.0,0.04,334.0,51.0,43.0,3.96,1.31,40.0,4Yr,"University of California, Berkeley (Berkeley, CA)",0
2006,1,,6,FrRnd,6,Tigers,Y,"$3,550,000 ",Andrew Miller(minors),LHP,7.7,185.0,74.0,0.0,0.054,0.108,612.0,55.0,55.0,4.03,1.34,63.0,4Yr,"University of North Carolina at Chapel Hill (Chapel Hill, NC)",1
2006,1,,7,FrRnd,7,Dodgers,Y,"$2,300,000 ",Clayton Kershaw(minors),LHP,73.9,357.0,698.0,1.0,0.162,0.39,389.0,190.0,86.0,2.49,1.01,0.0,HS,"Highland Park HS (University Park, TX)",1
2006,1,,8,FrRnd,8,Reds,Y,"$2,000,000 ",Drew Stubbs(minors),OF,7.9,911.0,2834.0,92.0,0.242,0.704,,,,,,,4Yr,"University of Texas at Austin (Austin, TX)",0
2006,1,,9,FrRnd,9,Orioles,Y,"$2,100,000 ",Billy Rowell(minors),3B,,,,,,,,,,,,,HS,"Bishop Eustace Preparatory School (Pennsauken, NJ)",0
2006,1,,10,FrRnd,10,Giants,Y,"$2,025,000 ",Tim Lincecum(minors),RHP,19.5,262.0,474.0,0.0,0.112,0.3,278.0,110.0,89.0,3.74,1.29,1.0,4Yr,"University of Washington (Seattle, WA)",0
2006,1,,11,FrRnd,11,Diamondbacks,Y,"$3,000,000 ",Max Scherzer(minors),RHP,68.1,238.0,464.0,1.0,0.168,0.381,415.0,195.0,98.0,3.15,1.08,0.0,4Yr,"University of Missouri (Columbia, MO)",0
2006,1,,12,FrRnd,12,Rangers,Y,"$1,600,000 ",Kasey Kiker(minors),LHP,,,,,,,,,,,,,HS,"Russell County HS (Seale, AL)",0
2006,1,,13,FrRnd,13,Cubs,Y,"$1,475,000 ",Tyler Colvin(minors),OF,0.9,441.0,1215.0,49.0,0.239,0.733,,,,,,,4Yr,"Clemson University (Clemson, SC)",0
2006,1,,14,FrRnd,14,Blue Jays,Y,"$1,700,000 ",Travis Snider(minors),OF,4.3,630.0,1783.0,54.0,0.244,0.709,1.0,0.0,0.0,18.0,3.0,0.0,HS,"Henry M. Jackson HS (Mill Creek, WA)",0
2006,1,,15,FrRnd,15,Nationals,Y,"$1,625,000 ",Chris Marrero(minors),OF,-1.5,54.0,163.0,1.0,0.209,0.493,,,,,,,HS,"Monsignor Edward Pace HS (Miami Gardens, FL)",0
2006,1,,16,FrRnd,16,Brewers,Y,"$1,550,000 ",Jeremy Jeffress(minors),RHP,8.8,290.0,3.0,0.0,0.0,0.0,414.0,32.0,12.0,3.08,1.32,52.0,HS,"Halifax County HS (South Boston, VA)",0
2006,1,,17,FrRnd,17,Padres,Y,"$1,575,000 ",Matt Antonelli(minors),3B,-0.3,21.0,57.0,1.0,0.193,0.573,,,,,,,4Yr,"Wake Forest University (Winston-Salem, NC)",1
2006,1,,18,FrRnd,18,Phillies via Mets,Y,"$1,550,000 ",*Kyle Drabek(minors),RHP,-0.1,3.0,2.0,0.0,0.0,0.0,43.0,8.0,15.0,5.26,1.7,0.0,HS,"The Woodlands HS (The Woodlands, TX)",0
2006,1,,19,FrRnd,19,Marlins,Y,"$1,525,000 ",Brett Sinkbeil(minors),RHP,-0.2,3.0,0.0,0.0,,,3.0,0.0,0.0,13.5,3.5,0.0,4Yr,"Missouri State University (Springfield, MO)",0
2006,1,,20,FrRnd,20,Twins,Y,"$1,500,000 ",Chris Parmelee(minors),OF,0.0,311.0,917.0,30.0,0.248,0.717,,,,,,,HS,"Chino Hills HS (Chino Hills, CA)",1
2006,1,,21,FrRnd,21,Yankees via Phillies,Y,"$2,250,000 ",*Ian Kennedy(minors),RHP,18.5,215.0,321.0,1.0,0.131,0.394,456.0,103.0,110.0,4.1,1.28,60.0,4Yr,"University of Southern California (Los Angeles, CA)",1
2006,1,,22,FrRnd,22,Nationals via Athletics,Y,"$1,425,000 ",*Colton Willems(minors),RHP,,,,,,,,,,,,,HS,"John Carroll Catholic HS (Fort Pierce, FL)",0
2006,1,,23,FrRnd,23,Astros,Y,"$1,400,000 ",Maxwell Sapp(minors),C,,,,,,,,,,,,,HS,"Bishop Moore HS (Orlando, FL)",0
2006,1,,24,FrRnd,24,Braves,Y,"$1,375,000 ",Cody Johnson(minors),OF,,,,,,,,,,,,,HS,"A. Crawford Mosley HS (Lynn Haven, FL)",0
2006,1,,25,FrRnd,25,Angels via Indians,Y,"$1,350,000 ",*Hank Conger(minors),C,2.0,373.0,1013.0,31.0,0.221,0.66,,,,,,,HS,"Huntington Beach HS (Huntington Beach, CA)",0
2006,1,,26,FrRnd,26,Dodgers via Angels,Y,"$1,325,000 ",*Bryan Morris(minors),RHP,2.7,219.0,7.0,0.0,0.143,0.286,231.0,20.0,12.0,3.13,1.37,1.0,JC,"Motlow State Community College (Lynchburg, TN)",1
2006,1,,27,FrRnd,27,Red Sox,Y,"$1,300,000 ",Jason Place(minors),OF,,,,,,,,,,,,,HS,"Wren HS (Piedmont, SC)",0
2006,1,,28,FrRnd,28,Red Sox via Yankees,Y,"$1,550,000 ",*Daniel Bard(minors),RHP,6.3,80.0,3.0,0.0,0.333,0.667,330.0,24.0,31.0,3.81,1.27,47.0,4Yr,"University of North Carolina at Chapel Hill (Chapel Hill, NC)",0
2006,1,,29,FrRnd,29,White Sox,Y,"$1,050,000 ",Kyle McCulloch(minors),RHP,,,,,,,,,,,,,4Yr,"University of Texas at Austin (Austin, TX)",0
2006,1,,30,FrRnd,30,Cardinals,Y,"$950,000 ",Adam Ottavino(minors),RHP,12.4,354.0,24.0,0.0,0.083,0.203,565.0,34.0,33.0,3.55,1.31,30.0,4Yr,"Northeastern University (Boston, MA)",1
2006,1s,,31,FrRnd,31,Dodgers,Y,"$1,000,000 ",*Preston Mattingly(minors),SS,,,,,,,,,,,,,HS,"Central HS (Evansville, IN)",1
2006,1s,,32,FrRnd,32,Orioles,Y,"$1,000,000 ",*Pedro Beato(minors),RHP,-1.0,67.0,0.0,0.0,,,85.0,4.0,2.0,4.31,1.3,0.0,JC,"St. Petersburg College (St. Petersburg, FL)",0
2006,1s,,33,FrRnd,33,Giants,Y,"$1,000,000 ",*Emmanuel Burriss(minors),SS,-2.7,325.0,768.0,1.0,0.237,0.565,,,,,,,4Yr,"Kent State University (Kent, OH)",0
2006,1s,,34,FrRnd,34,Diamondbacks,Y,"$900,000 ",*Brooks Brown(minors),RHP,0.9,63.0,1.0,0.0,0.0,0.0,64.0,1.0,4.0,3.97,1.24,0.0,4Yr,"University of Georgia (Athens, GA)",0
2006,1s,,35,FrRnd,35,Padres,Y,"$950,000 ",*Kyler Burke(minors),OF,,,,,,,,,,,,,HS,"Ooltewah HS (Ooltewah, TN)",1
2006,1s,,36,FrRnd,36,Marlins,Y,"$950,000 ",*Chris Coghlan(minors),3B,1.1,801.0,2580.0,53.0,0.258,0.731,,,,,,,4Yr,"University of Mississippi (Oxford, MS)",0
2006,1s,,37,FrRnd,37,Phillies,Y,"$925,000 ",*Adrian Cardenas(minors),SS,-0.3,45.0,60.0,0.0,0.183,0.552,,,,,,,HS,"Monsignor Edward Pace HS (Miami Gardens, FL)",0
2006,1s,,38,FrRnd,38,Braves,Y,"$900,000 ",*Cory Rasmus(minors),RHP,0.5,10.0,1.0,0.0,0.0,0.0,84.0,4.0,5.0,4.17,1.33,0.0,HS,"Russell County HS (Seale, AL)",0
2006,1s,,39,FrRnd,39,Indians,Y,"$900,000 ",*David Huff(minors),LHP,-1.8,22.0,8.0,0.0,0.125,0.25,120.0,25.0,30.0,5.17,1.51,0.0,4Yr,"University of California, Los Angeles (Los Angeles, CA)",0
2006,1s,,40,FrRnd,40,Red Sox,Y,"$850,000 ",*Kris Johnson(minors),LHP,0.0,5.0,3.0,0.0,0.0,0.0,7.0,0.0,3.0,5.32,1.77,0.0,4Yr,"Wichita State University (Wichita, KS)",0
2006,1s,,41,FrRnd,41,Yankees,Y,"$1,150,000 ",*Joba Chamberlain(minors),RHP,7.6,24.0,6.0,0.0,0.0,0.143,385.0,25.0,21.0,3.81,1.38,7.0,4Yr,"University of Nebraska-Lincoln (Lincoln, NE)",1
2006,1s,,42,FrRnd,42,Cardinals,Y,"$800,000 ",*Chris Perez(minors),RHP,4.7,125.0,2.0,0.0,0.0,0.0,393.0,16.0,24.0,3.51,1.24,133.0,4Yr,"University of Miami (Coral Gables, FL)",1
2006,1s,,43,FrRnd,43,Braves,Y,"$800,000 ",*Steve Evarts(minors),LHP,,,,,,,,,,,,,HS,"T. R. Robinson HS (Tampa, FL)",0
2006,1s,,44,FrRnd,44,Red Sox,Y,"$775,000 ",*Caleb Clay(minors),RHP,,,,,,,,,,,,,HS,"Cullman HS (Cullman, AL)",0
2007,1,,1,FrRnd,1,Devil Rays,Y,"$5,600,000 ",David Price(minors),LHP,39.6,58.0,65.0,0.0,0.123,0.298,379.0,155.0,82.0,3.33,1.16,1.0,4Yr,"Vanderbilt University (Nashville, TN)",0
2007,1,,2,FrRnd,2,Royals,Y,"$4,000,000 ",Mike Moustakas(minors),SS,13.2,1291.0,4633.0,199.0,0.248,0.744,,,,,,,HS,"Chatsworth Charter HS (Chatsworth, CA)",0
2007,1,,3,FrRnd,3,Cubs,Y,"$3,200,000 ",Josh Vitters(minors),3B,-1.3,36.0,99.0,2.0,0.121,0.395,,,,,,,HS,"Cypress HS (Cypress, CA)",1
2007,1,,4,FrRnd,4,Pirates,Y,"$2,475,000 ",Daniel Moskos(minors),LHP,0.2,30.0,0.0,0.0,,,31.0,1.0,1.0,2.96,1.56,0.0,4Yr,"Clemson University (Clemson, SC)",0
2007,1,,5,FrRnd,5,Orioles,Y,"$6,000,000 ",Matt Wieters(minors),C,18.3,1167.0,3994.0,146.0,0.249,0.722,,,,,,,4Yr,"Georgia Institute of Technology (Atlanta, GA)",0
2007,1,,6,FrRnd,6,Nationals,Y,"$2,150,000 ",Ross Detwiler(minors),LHP,0.4,203.0,121.0,0.0,0.066,0.155,293.0,30.0,51.0,4.56,1.46,1.0,4Yr,"Missouri State University (Springfield, MO)",0
2007,1,,7,FrRnd,7,Brewers,Y,"$2,000,000 ",Matt LaPorta(minors),1B,-1.0,291.0,967.0,31.0,0.238,0.695,,,,,,,4Yr,"University of Florida (Gainesville, FL)",0
2007,1,,8,FrRnd,8,Rockies,Y,"$1,800,000 ",Casey Weathers(minors),RHP,,,,,,,,,,,,,4Yr,"Vanderbilt University (Nashville, TN)",1
2007,1,,9,FrRnd,9,Diamondbacks,Y,"$2,100,000 ",Jarrod Parker(minors),RHP,6.5,4.0,8.0,0.0,0.125,0.375,62.0,25.0,16.0,3.68,1.24,0.0,HS,"Norwell HS (Ossian, IN)",1
2007,1,,10,FrRnd,10,Giants,Y,"$2,000,000 ",Madison Bumgarner(minors),LHP,39.7,313.0,633.0,19.0,0.172,0.525,341.0,131.0,114.0,3.33,1.13,0.0,HS,"South Caldwell HS (Hudson, NC)",0
2007,1,,11,FrRnd,11,Mariners,Y,"$1,900,000 ",Phillippe Aumont(minors),RHP,-0.7,44.0,1.0,0.0,0.0,0.5,46.0,1.0,6.0,6.8,1.99,2.0,HS,"Ecole Du Versant (Gatineau, QC)",0
2007,1,,12,FrRnd,12,Marlins,Y,"$1,800,000 ",Matt Dominguez(minors),3B,1.2,362.0,1272.0,42.0,0.231,0.644,,,,,,,HS,"Chatsworth Charter HS (Chatsworth, CA)",0
2007,1,,13,FrRnd,13,Indians,Y,"$1,575,000 ",Beau Mills(minors),1B,,,,,,,,,,,,,4Yr,"Lewis-Clark State College (Lewiston, ID)",1
2007,1,,14,FrRnd,14,Braves,Y,"$1,700,000 ",Jason Heyward(minors),OF,38.6,1579.0,5527.0,159.0,0.257,0.746,,,,,,,HS,"Henry County HS (McDonough, GA)",0
2007,1,,15,FrRnd,15,Reds,Y,"$1,400,000 ",Devin Mesoraco(minors),C,4.7,468.0,1402.0,58.0,0.232,0.715,,,,,,,HS,"Punxsutawney HS (Punxsutawney, PA)",0
2007,1,,16,FrRnd,16,Blue Jays via Rangers,Y,"$1,440,000 ",*Kevin Ahrens(minors),3B,,,,,,,,,,,,,HS,"Memorial HS (Houston, TX)",0
2007,1,,17,FrRnd,17,Rangers via Astros,Y,"$1,497,000 ",*Blake Beavan(minors),RHP,1.7,1.0,2.0,0.0,0.0,0.0,54.0,16.0,20.0,4.61,1.27,0.0,HS,"Irving HS (Irving, TX)",0
2007,1,,18,FrRnd,18,Cardinals,Y,"$1,395,000 ",Pete Kozma(minors),SS,-0.5,344.0,746.0,5.0,0.213,0.564,,,,,,,HS,"Owasso HS (Owasso, OK)",0
2007,1,,19,FrRnd,19,Phillies,Y,"$1,372,500 ",Joe Savery(minors),LHP,-0.1,37.0,2.0,0.0,0.0,0.0,44.0,3.0,2.0,3.83,1.26,0.0,4Yr,"Rice University (Houston, TX)",1
2007,1,,20,FrRnd,20,Dodgers via Red Sox,Y,"$1,350,000 ",*Chris Withrow(minors),RHP,1.4,84.0,1.0,0.0,0.0,0.0,92.0,6.0,0.0,3.07,1.14,1.0,HS,"Midland HS (Midland, TX)",0
2007,1,,21,FrRnd,21,Blue Jays,Y,"$1,372,500 ",J.P. Arencibia(minors),C,1.9,466.0,1573.0,80.0,0.212,0.67,1.0,0.0,0.0,0.0,1.0,0.0,4Yr,"University of Tennessee (Knoxville, TN)",0
2007,1,,22,FrRnd,22,Giants via Dodgers,Y,"$1,290,000 ",*Tim Alderson(minors),RHP,,,,,,,,,,,,,HS,"Horizon HS (Scottsdale, AZ)",0
2007,1,,23,FrRnd,23,Padres,Y,"$1,260,000 ",Nick Schmidt(minors),LHP,,,,,,,,,,,,,4Yr,"University of Arkansas (Fayetteville, AR)",0
2007,1,,24,FrRnd,24,Rangers via Angels,Y,"$1,237,500 ",*Michael Main(minors),RHP,,,,,,,,,,,,,HS,"DeLand HS (DeLand, FL)",0
2007,1,,25,FrRnd,25,White Sox,Y,"$1,200,000 ",Aaron Poreda(minors),LHP,0.2,9.0,0.0,0.0,,,40.0,3.0,1.0,4.67,1.73,0.0,4Yr,"University of San Francisco (San Francisco, CA)",0
2007,1,,26,FrRnd,26,Athletics,Y,"$1,192,500 ",James Simmons(minors),RHP,,,,,,,,,,,,,4Yr,"University of California, Riverside (Riverside, CA)",0
2007,1,,27,FrRnd,27,Tigers,Y,"$3,580,000 ",Rick Porcello(minors),RHP,18.8,24.0,45.0,0.0,0.178,0.4,355.0,150.0,125.0,4.4,1.32,0.0,HS,"Seton Hall Preparatory School (West Orange, NJ)",0
2007,1,,28,FrRnd,28,Twins,Y,"$750,000 ",Ben Revere(minors),OF,7.9,857.0,3138.0,7.0,0.284,0.662,,,,,,,HS,"Lexington Catholic HS (Lexington, KY)",0
2007,1,,29,FrRnd,29,Giants via Mets,Y,"$1,000,000 ",*Wendell Fairley(minors),OF,,,,,,,,,,,,,HS,"George County HS (Lucedale, MS)",0
2007,1,,30,FrRnd,30,Yankees,Y,"$3,350,000 ",Andrew Brackman(minors),RHP,0.1,0.0,0.0,0.0,,,3.0,0.0,0.0,0.0,1.71,0.0,4Yr,"North Carolina State University (Raleigh, NC)",1
2007,1s,,31,FrRnd,31,Nationals,Y,"$1,000,000 ",*Josh Smoker(minors),LHP,-0.7,75.0,4.0,0.0,0.0,0.0,82.0,4.0,2.0,5.35,1.7,0.0,HS,"Calhoun HS (Calhoun, GA)",0
2007,1s,,32,FrRnd,32,Giants,Y,"$915,750 ",*Nick Noonan(minors),2B,-1.2,83.0,145.0,1.0,0.193,0.473,,,,,,,HS,"Parker HS (San Diego, CA)",0
2007,1s,,33,FrRnd,33,Braves,Y,"$900,000 ",*Jon Gilmore(minors),3B,,,,,,,,,,,,,HS,"Iowa City HS (Iowa City, IA)",0
2007,1s,,34,FrRnd,34,Reds,Y,"$825,000 ",*Todd Frazier(minors),3B,25.3,1244.0,4392.0,218.0,0.241,0.763,1.0,0.0,0.0,0.0,0.0,0.0,4Yr,"Rutgers, the State University of New Jersey (New Brunswick, NJ)",0
2007,1s,,35,FrRnd,35,Rangers,Y,"$800,000 ",*Julio Borbon(minors),OF,1.7,294.0,802.0,8.0,0.273,0.665,,,,,,,4Yr,"University of Tennessee (Knoxville, TN)",0
2007,1s,,36,FrRnd,36,Cardinals,Y,"$650,000 ",*Clayton Mortensen(minors),RHP,-0.5,19.0,16.0,0.0,0.0,0.056,74.0,6.0,11.0,4.68,1.44,0.0,4Yr,"Gonzaga University (Spokane, WA)",0
2007,1s,,37,FrRnd,37,Phillies,Y,"$832,500 ",*Travis d'Arnaud(minors),C,5.1,659.0,2278.0,90.0,0.251,0.736,,,,,,,HS,"Lakewood HS (Lakewood, CA)",1
2007,1s,,38,FrRnd,38,Blue Jays,Y,"$810,000 ",*Brett Cecil(minors),LHP,6.7,122.0,7.0,0.0,0.0,0.0,443.0,44.0,47.0,4.29,1.36,12.0,4Yr,"University of Maryland (College Park, MD)",0
2007,1s,,39,FrRnd,39,Dodgers,Y,"$787,500 ",*James Adkins(minors),LHP,,,,,,,,,,,,,4Yr,"University of Tennessee (Knoxville, TN)",0
2007,1s,,40,FrRnd,40,Padres,Y,"$765,000 ",*Kellen Kulbacki(minors),OF,,,,,,,,,,,,,4Yr,"James Madison University (Harrisonburg, VA)",0
2007,1s,,41,FrRnd,41,Athletics,Y,"$742,500 ",*Sean Doolittle(minors),1B,10.0,189.0,4.0,0.0,0.0,0.0,463.0,26.0,24.0,3.2,1.01,112.0,4Yr,"University of Virginia (Charlottesville, VA)",0
