Year,Rnd,DT,OvPck,FrRnd,RdPck,Tm,Signed,Bonus,Name,Pos,WAR,G,AB,HR,BA,OPS,G.1,W,L,ERA,WHIP,SV,Type,Drafted Out of,Team Made Playoffs
2011,1,,2,FrRnd,2,Mariners,Y,"$6,350,000 ",Danny Hultzen(minors),LHP,0.2,6.0,0.0,0.0,,,6.0,0.0,0.0,0.0,1.8,0.0,4Yr,"University of Virginia (Charlottesville, VA)",0
2011,1,,3,FrRnd,3,Diamondbacks,Y,"$3,400,000 ",Trevor Bauer(minors),RHP,21.0,40.0,73.0,0.0,0.069,0.185,222.0,83.0,69.0,3.79,1.24,1.0,4Yr,"University of California, Los Angeles (Los Angeles, CA)",1
2011,1,,4,FrRnd,4,Orioles,Y,"$4,000,000 ",Dylan Bundy(minors),RHP,7.8,8.0,14.0,0.0,0.143,0.286,175.0,50.0,61.0,4.7,1.3,0.0,HS,"Owasso HS (Owasso, OK)",0
2011,1,,5,FrRnd,5,Royals,Y,"$7,500,000 ",Bubba Starling(minors),OF,-1.8,91.0,245.0,5.0,0.204,0.544,,,,,,,HS,"Gardner-Edgerton HS (Gardner, KS)",0
2011,1,,6,FrRnd,6,Nationals,Y,"$6,000,000 ",Anthony Rendon(minors),3B,33.1,1071.0,3992.0,156.0,0.285,0.848,,,,,,,4Yr,"Rice University (Houston, TX)",0
2011,1s,,7,FrRnd,7,Diamondbacks,Y,"$5,000,000 ",*Archie Bradley(minors),RHP,5.8,274.0,63.0,0.0,0.095,0.189,329.0,30.0,29.0,3.92,1.36,32.0,HS,"Broken Arrow HS (Broken Arrow, OK)",1
2011,1,,8,FrRnd,8,Indians,Y,"$2,900,000 ",Francisco Lindor(minors),SS,33.2,983.0,3904.0,171.0,0.275,0.814,,,,,,,HS,"Montverde Academy (Montverde, FL)",0
2011,1,,9,FrRnd,9,Cubs,Y,"$2,625,000 ",Javier Baez(minors),SS,23.7,930.0,3301.0,156.0,0.26,0.769,,,,,,,HS,"Arlington Country Day School (Jacksonville, FL)",0
2011,1s,,10,FrRnd,10,Padres,Y,"$1,863,000 ",*Cory Spangenberg(minors),2B,4.7,419.0,1250.0,29.0,0.256,0.704,2.0,0.0,0.0,13.5,3.5,0.0,JC,"Indian River State College (Fort Pierce, FL)",0
2011,1,,11,FrRnd,11,Astros,Y,"$2,525,000 ",George Springer(minors),OF,32.3,947.0,3660.0,211.0,0.268,0.853,,,,,,,4Yr,"University of Connecticut (Storrs, CT)",0
2011,1,,12,FrRnd,12,Brewers,Y,"$2,525,000 ",Taylor Jungmann(minors),RHP,1.2,30.0,45.0,0.0,0.244,0.55,30.0,9.0,13.0,4.54,1.38,0.0,4Yr,"University of Texas at Austin (Austin, TX)",1
2011,1,,13,FrRnd,13,Mets,Y,"$2,100,000 ",Brandon Nimmo(minors),OF,14.7,531.0,1674.0,54.0,0.268,0.831,,,,,,,HS,"East HS (Cheyenne, WY)",0
2011,1,,14,FrRnd,14,Marlins,Y,"$2,000,000 ",Jose Fernandez(minors),RHP,14.2,71.0,136.0,2.0,0.213,0.519,76.0,38.0,17.0,2.58,1.05,0.0,HS,"Braulio Alonso HS (Tampa, FL)",0
2011,1s,,15,FrRnd,15,Brewers,Y,"$2,000,000 ",*Jed Bradley(minors),LHP,0.0,6.0,0.0,0.0,,,6.0,1.0,1.0,5.14,1.86,0.0,4Yr,"Georgia Institute of Technology (Atlanta, GA)",1
2011,1,,16,FrRnd,16,Dodgers,Y,"$1,589,000 ",Chris Reed(minors),LHP,0.0,2.0,0.0,0.0,,,2.0,0.0,0.0,4.5,1.75,0.0,4Yr,"Stanford University (Palo Alto, CA)",0
2011,1,,17,FrRnd,17,Angels,Y,"$1,467,000 ",C.J. Cron(minors),1B,13.4,910.0,3156.0,166.0,0.265,0.808,,,,,,,4Yr,"University of Utah (Salt Lake City, UT)",0
2011,1,,18,FrRnd,18,Athletics,Y,"$1,540,000 ",Sonny Gray(minors),RHP,24.0,63.0,99.0,0.0,0.141,0.328,234.0,86.0,73.0,3.56,1.21,0.0,4Yr,"Vanderbilt University (Nashville, TN)",0
2011,1,,19,FrRnd,19,Red Sox via Tigers,Y,"$1,500,000 ",*Matt Barnes(minors),RHP,3.2,25.0,1.0,0.0,0.0,0.0,405.0,32.0,29.0,4.2,1.35,41.0,4Yr,"University of Connecticut (Storrs, CT)",0
2011,1,,20,FrRnd,20,Rockies,Y,"$1,400,000 ",Tyler Anderson(minors),LHP,9.3,92.0,157.0,2.0,0.096,0.284,132.0,38.0,39.0,4.44,1.28,0.0,4Yr,"University of Oregon (Eugene, OR)",0
2011,1,,21,FrRnd,21,Blue Jays,N,,Tyler Beede(minors),RHP,0.2,28.0,40.0,0.0,0.1,0.263,46.0,5.0,12.0,5.07,1.53,0.0,HS,"Lawrence Academy (Groton, MA)",0
2011,1,,22,FrRnd,22,Cardinals,Y,"$1,300,000 ",Kolten Wong(minors),2B,20.7,1029.0,3349.0,73.0,0.261,0.727,,,,,,,4Yr,"University of Hawaii at Manoa (Honolulu, HI)",1
2011,1,,23,FrRnd,23,Nationals via White Sox,Y,"$2,000,000 ",*Alex Meyer(minors),RHP,0.7,3.0,2.0,0.0,0.5,1.0,22.0,5.0,8.0,4.63,1.46,0.0,4Yr,"University of Kentucky (Lexington, KY)",0
2011,1,,24,FrRnd,24,Rays via Red Sox,Y,"$1,600,000 ",*Taylor Guerrieri(minors),RHP,0.2,2.0,0.0,0.0,,,29.0,0.0,0.0,5.5,1.69,0.0,HS,"Spring Valley HS (Columbia, SC)",1
2011,1,,25,FrRnd,25,Padres,Y,"$2,750,000 ",Joe Ross(minors),RHP,4.9,110.0,157.0,0.0,0.185,0.434,98.0,26.0,28.0,4.26,1.33,0.0,HS,"Bishop O'Dowd HS (Oakland, CA)",0
2011,1,,26,FrRnd,26,Red Sox via Rangers,Y,"$2,500,000 ",*Blake Swihart(minors),C,-0.3,234.0,639.0,12.0,0.243,0.656,,,,,,,HS,"V Sue Cleveland HS (Rio Rancho, NM)",0
2011,1,,27,FrRnd,27,Reds,Y,"$2,000,000 ",Robert Stephenson(minors),RHP,-0.4,137.0,36.0,0.0,0.028,0.082,179.0,12.0,15.0,4.94,1.45,2.0,HS,"Alhambra HS (Martinez, CA)",0
2011,1,,28,FrRnd,28,Braves,Y,"$1,134,000 ",Sean Gilmartin(minors),LHP,1.1,64.0,7.0,0.0,0.429,1.0,81.0,4.0,5.0,4.34,1.42,0.0,4Yr,"Florida State University (Tallahassee, FL)",0
2011,1,,29,FrRnd,29,Giants,Y,"$1,116,000 ",Joe Panik(minors),SS,5.4,818.0,2778.0,42.0,0.264,0.7,,,,,,,4Yr,"St. John's University (Queens, NY)",0
2011,1,,30,FrRnd,30,Twins,Y,"$1,175,000 ",Levi Michael(minors),SS,,,,,,,,,,,,,4Yr,"University of North Carolina at Chapel Hill (Chapel Hill, NC)",0
2011,1,,31,FrRnd,31,Rays via Yankees,Y,"$1,150,000 ",*Mikie Mahtook(minors),OF,0.3,291.0,884.0,33.0,0.235,0.697,,,,,,,4Yr,"Louisiana State University (Baton Rouge, LA)",1
2011,1,,32,FrRnd,32,Rays,Y,"$963,000 ",Jake Hager(minors),SS,-0.1,42.0,76.0,0.0,0.197,0.531,3.0,0.0,0.0,7.71,1.29,0.0,HS,"Sierra Vista HS (Las Vegas, NV)",1
2011,1,,33,FrRnd,33,Rangers via Phillies,Y,"$936,000 ",*Kevin Matthews(minors),LHP,,,,,,,,,,,,,HS,"Richmond Hill HS (Richmond Hill, GA)",1
2011,1s,,34,FrRnd,34,Nationals,Y,"$3,000,000 ",*Brian Goodwin(minors),OF,1.5,429.0,1244.0,50.0,0.244,0.757,,,,,,,4Yr,"Miami Dade College, Kendall Campus (Miami, FL)",0
2011,1s,,35,FrRnd,35,Blue Jays,Y,"$990,000 ",*Jacob Anderson(minors),OF,,,,,,,,,,,,,HS,"Chino HS (Chino, CA)",0
2011,1s,,36,FrRnd,36,Red Sox,Y,"$1,550,000 ",*Henry Owens(minors),LHP,0.1,1.0,2.0,0.0,0.0,0.0,16.0,4.0,6.0,5.19,1.52,0.0,HS,"Edison HS (Huntington Beach, CA)",0
2011,1s,,37,FrRnd,37,Rangers,Y,"$873,000 ",*Zach Cone(minors),OF,,,,,,,,,,,,,4Yr,"University of Georgia (Athens, GA)",1
2011,1s,,38,FrRnd,38,Rays,Y,"$860,000 ",*Brandon Martin(minors),SS,,,,,,,,,,,,,HS,"Santiago HS (Corona, CA)",1
2011,1s,,39,FrRnd,39,Phillies,Y,"$1,000,000 ",*Larry Greene(minors),OF,,,,,,,,,,,,,HS,"Berrien County HS (Nashville, GA)",1
2011,1s,,40,FrRnd,40,Red Sox,Y,"$1,100,000 ",*Jackie Bradley Jr.(minors),OF,17.4,1080.0,3507.0,105.0,0.229,0.697,,,,,,,4Yr,"University of South Carolina (Columbia, SC)",0
2011,1s,,41,FrRnd,41,Rays,Y,"$1,500,000 ",*Tyler Goeddel(minors),3B,-1.2,92.0,213.0,4.0,0.193,0.549,,,,,,,HS,"St. Francis HS (Mountain View, CA)",1
2011,1s,,42,FrRnd,42,Rays,Y,"$650,000 ",*Jeff Ames(minors),RHP,,,,,,,,,,,,,JC,"Lower Columbia College (Longview, WA)",1
2011,1s,,43,FrRnd,43,Diamondbacks,Y,"$875,000 ",*Andrew Chafin(minors),LHP,7.2,347.0,5.0,0.0,0.2,0.4,441.0,12.0,18.0,3.25,1.22,9.0,4Yr,"Kent State University (Kent, OH)",1
2011,1s,,44,FrRnd,44,Mets,Y,"$937,500 ",*Michael Fulmer(minors),RHP,12.7,11.0,13.0,0.0,0.0,0.0,168.0,31.0,41.0,3.85,1.23,15.0,HS,"Deer Creek HS (Edmond, OK)",0
2011,1s,,45,FrRnd,45,Rockies,Y,"$915,000 ",*Trevor Story(minors),SS,28.9,820.0,3107.0,172.0,0.268,0.85,,,,,,,HS,"Irving HS (Irving, TX)",0
2011,1s,,46,FrRnd,46,Blue Jays,Y,"$500,000 ",*Joe Musgrove(minors),RHP,10.0,104.0,138.0,0.0,0.145,0.358,154.0,48.0,49.0,3.81,1.16,2.0,HS,"Grossmont HS (La Mesa, CA)",0
2011,1s,,47,FrRnd,47,White Sox,Y,"$795,000 ",*Keenyn Walker(minors),OF,,,,,,,,,,,,,JC,"Central Arizona College (Coolidge, AZ)",0
2011,1s,,48,FrRnd,48,Padres,Y,"$718,000 ",*Michael Kelly(minors),RHP,0.1,0.0,0.0,,,,2.0,0.0,0.0,0.0,0.5,0.0,HS,"West Boca Raton Community HS (Boca Raton, FL)",0
2011,1s,,49,FrRnd,49,Giants,Y,"$900,000 ",*Kyle Crick(minors),RHP,1.6,162.0,0.0,0.0,,,194.0,9.0,11.0,3.56,1.32,2.0,HS,"Sherman HS (Sherman, TX)",0
2011,1s,,50,FrRnd,50,Twins,Y,"$1,050,000 ",*Travis Harrison(minors),3B,,,,,,,,,,,,,HS,"Tustin HS (Tustin, CA)",0
2011,1s,,51,FrRnd,51,Yankees,Y,"$750,000 ",*Dante Bichette(minors),3B,,,,,,,,,,,,,HS,"Orangewood Christian HS (Maitland, FL)",1
2011,1s,,52,FrRnd,52,Rays,Y,"$684,000 ",*Blake Snell(minors),LHP,12.7,31.0,42.0,0.0,0.095,0.269,143.0,49.0,41.0,3.51,1.26,0.0,HS,"Shorewood HS (Shoreline, WA)",1
2011,1s,,53,FrRnd,53,Blue Jays,Y,"$800,000 ",*Dwight Smith Jr.(minors),OF,-0.8,169.0,512.0,17.0,0.248,0.726,,,,,,,HS,"McIntosh HS (Peachtree City, GA)",0
2011,1s,,54,FrRnd,54,Padres,N,,*Brett Austin(minors),C,,,,,,,,,,,,,HS,"Providence HS (Charlotte, NC)",0
2011,1s,,55,FrRnd,55,Twins,Y,"$1,000,000 ",*Hudson Boyd(minors),RHP,,,,,,,,,,,,,HS,"Bishop Verot HS (Fort Myers, FL)",0
2011,1s,,56,FrRnd,56,Rays,Y,"$625,000 ",*Kes Carter(minors),OF,,,,,,,,,,,,,4Yr,"Western Kentucky University (Bowling Green, KY)",1
2011,1s,,57,FrRnd,57,Blue Jays,Y,"$1,650,000 ",*Kevin Comer(minors),RHP,,,,,,,,,,,,,HS,"Seneca HS (Tabernacle, NJ)",0
2011,1s,,58,FrRnd,58,Padres,Y,"$624,600 ",*Jace Peterson(minors),SS,3.6,700.0,1925.0,35.0,0.232,0.668,3.0,0.0,0.0,18.0,3.67,0.0,4Yr,"McNeese State University (Lake Charles, LA)",0
2011,1s,,59,FrRnd,59,Rays,Y,"$370,000 ",*Grayson Garvin(minors),LHP,,,,,,,,,,,,,4Yr,"Vanderbilt University (Nashville, TN)",1
2011,1s,,60,FrRnd,60,Rays,Y,"$490,000 ",*James Harris(minors),OF,,,,,,,,,,,,,HS,"Oakland Technical HS (Oakland, CA)",1
2012,1,,1,FrRnd,1,Astros,Y,"$4,800,000 ",Carlos Correa(minors),SS,36.0,812.0,3054.0,142.0,0.278,0.836,,,,,,,HS,"Puerto Rico Baseball Academy (Gurabo, Puerto Rico)",0
2012,1,,2,FrRnd,2,Twins,Y,"$6,000,000 ",Byron Buxton(minors),OF,18.9,555.0,1845.0,92.0,0.246,0.775,,,,,,,HS,"Appling County HS (Baxley, GA)",0
2012,1,,3,FrRnd,3,Mariners,Y,"$4,000,000 ",Mike Zunino(minors),C,10.1,850.0,2674.0,146.0,0.2,0.681,,,,,,,4Yr,"University of Florida (Gainesville, FL)",0
2012,1,,4,FrRnd,4,Orioles,Y,"$4,320,000 ",Kevin Gausman(minors),RHP,18.1,81.0,110.0,0.0,0.109,0.27,252.0,70.0,78.0,3.94,1.28,0.0,4Yr,"Louisiana State University (Baton Rouge, LA)",1
2012,1,,5,FrRnd,5,Royals,Y,"$3,000,000 ",Kyle Zimmer(minors),RHP,0.0,4.0,0.0,0.0,,,83.0,5.0,2.0,5.19,1.54,2.0,4Yr,"University of San Francisco (San Francisco, CA)",0
2012,1,,6,FrRnd,6,Cubs,Y,"$3,900,000 ",Albert Almora(minors),OF,2.7,580.0,1429.0,33.0,0.264,0.69,1.0,0.0,0.0,27.0,2.0,0.0,HS,"Mater Academy Charter School (Hialeah, FL)",0
2012,1,,7,FrRnd,7,Padres,Y,"$3,000,000 ",Max Fried(minors),LHP,15.9,93.0,126.0,0.0,0.214,0.542,111.0,48.0,20.0,3.22,1.19,0.0,HS,"Harvard-Westlake HS (Los Angeles, CA)",0
2012,1,,8,FrRnd,8,Pirates,N,,Mark Appel(minors),RHP,0.1,0.0,0.0,,,,2.0,0.0,0.0,0.0,0.5,0.0,4Yr,"Stanford University (Palo Alto, CA)",0
2012,1,,9,FrRnd,9,Marlins,Y,"$2,600,000 ",Andrew Heaney(minors),LHP,6.4,15.0,24.0,0.0,0.125,0.285,124.0,33.0,38.0,4.63,1.25,0.0,4Yr,"Oklahoma State University (Stillwater, OK)",0
2012,1,,10,FrRnd,10,Rockies,Y,"$2,600,000 ",David Dahl(minors),OF,0.6,327.0,1143.0,42.0,0.272,0.781,,,,,,,HS,"Oak Mountain HS (Birmingham, AL)",0
2012,1,,11,FrRnd,11,Athletics,Y,"$2,625,000 ",Addison Russell(minors),SS,11.3,615.0,1987.0,60.0,0.242,0.704,,,,,,,HS,"Pace HS (Pace, FL)",1
2012,1,,12,FrRnd,12,Mets,Y,"$2,300,000 ",Gavin Cecchini(minors),SS,-0.5,36.0,83.0,1.0,0.217,0.571,,,,,,,HS,"Alfred M. Barbe HS (Lake Charles, LA)",0
2012,1,,13,FrRnd,13,White Sox,Y,"$2,475,000 ",Courtney Hawkins(minors),OF,,,,,,,,,,,,,HS,"Mary Carroll HS (Corpus Christi, TX)",0
2012,1,,14,FrRnd,14,Reds,Y,"$2,000,000 ",Nick Travieso(minors),RHP,,,,,,,,,,,,,HS,"Archbishop McCarthy HS (Southwest Ranches, FL)",1
2012,1,,15,FrRnd,15,Indians,Y,"$1,750,000 ",Tyler Naquin(minors),OF,4.0,491.0,1487.0,55.0,0.271,0.779,,,,,,,4Yr,"Texas A&M University (College Station, TX)",0
2012,1,,16,FrRnd,16,Nationals,Y,"$2,925,000 ",Lucas Giolito(minors),RHP,10.4,13.0,18.0,0.0,0.167,0.333,131.0,47.0,42.0,4.26,1.22,0.0,HS,"Harvard-Westlake HS (Los Angeles, CA)",1
2012,1,,17,FrRnd,17,Blue Jays,Y,"$1,750,000 ",D.J. Davis(minors),OF,,,,,,,,,,,,,HS,"Stone County HS (Wiggins, MS)",0
2012,1,,18,FrRnd,18,Dodgers,Y,"$2,350,000 ",Corey Seager(minors),SS,22.9,712.0,2719.0,119.0,0.289,0.853,,,,,,,HS,"Northwest Cabarrus HS (Concord, NC)",0
2012,1,,19,FrRnd,19,Cardinals via Angels,Y,"$1,900,000 ",*Michael Wacha(minors),RHP,9.4,159.0,251.0,0.0,0.092,0.222,215.0,69.0,49.0,4.05,1.32,0.0,4Yr,"Texas A&M University (College Station, TX)",1
2012,1,,20,FrRnd,20,Giants,Y,"$1,850,000 ",Chris Stratton(minors),RHP,1.0,138.0,64.0,0.0,0.125,0.264,211.0,29.0,23.0,4.6,1.45,11.0,4Yr,"Mississippi State University (Mississippi State, MS)",1
2012,1,,21,FrRnd,21,Braves,Y,"$1,650,000 ",Lucas Sims(minors),RHP,0.9,89.0,27.0,0.0,0.074,0.148,120.0,14.0,10.0,4.97,1.29,8.0,HS,"Brookwood HS (Snellville, GA)",1
2012,1,,22,FrRnd,22,Blue Jays,Y,"$1,800,000 ",*Marcus Stroman(minors),RHP,17.5,56.0,89.0,1.0,0.101,0.308,188.0,63.0,65.0,3.71,1.26,1.0,4Yr,"Duke University (Durham, NC)",0
2012,1,,23,FrRnd,23,Cardinals,Y,"$1,600,000 ",James Ramsey(minors),OF,,,,,,,,,,,,,4Yr,"Florida State University (Tallahassee, FL)",1
2012,1,,24,FrRnd,24,Red Sox,Y,"$2,050,000 ",Deven Marrero(minors),SS,-0.2,173.0,335.0,6.0,0.194,0.534,,,,,,,4Yr,"Arizona State University (Tempe, AZ)",0
2012,1,,25,FrRnd,25,Rays,Y,"$1,710,000 ",Richie Shaffer(minors),3B,0.0,51.0,122.0,5.0,0.213,0.72,,,,,,,4Yr,"Clemson University (Clemson, SC)",0
2012,1,,26,FrRnd,26,Diamondbacks,Y,"$1,700,000 ",Stryker Trahan(minors),C,,,,,,,,,,,,,HS,"Acadiana HS (Lafayette, LA)",0
2012,1,,27,FrRnd,27,Brewers via Tigers,Y,"$1,675,000 ",*Clint Coulter(minors),C,,,,,,,,,,,,,HS,"Union HS (Camas, WA)",0
2012,1,,28,FrRnd,28,Brewers,Y,"$1,525,000 ",Victor Roache(minors),OF,,,,,,,,,,,,,4Yr,"Georgia Southern University (Statesboro, GA)",0
2012,1,,29,FrRnd,29,Rangers,Y,"$1,625,000 ",Lewis Brinson(minors),OF,-3.4,341.0,1035.0,25.0,0.199,0.57,,,,,,,HS,"Coral Springs HS (Coral Springs, FL)",1
2012,1,,30,FrRnd,30,Yankees,Y,"$1,200,000 ",Ty Hensley(minors),RHP,,,,,,,,,,,,,HS,"Edmond Santa Fe HS (Edmond, OK)",1
2012,1s,,31,FrRnd,31,Red Sox,Y,"$1,575,000 ",*Brian Johnson(minors),LHP,0.9,6.0,7.0,0.0,0.143,0.286,65.0,7.0,9.0,4.74,1.55,0.0,4Yr,"University of Florida (Gainesville, FL)",0
2012,1s,,32,FrRnd,32,Twins,Y,"$1,550,000 ",*Jose Berrios(minors),RHP,10.8,10.0,17.0,0.0,0.118,0.284,164.0,66.0,51.0,4.19,1.24,0.0,HS,"Papa Juan HS (Bayamon, Puerto Rico)",0
2012,1s,,33,FrRnd,33,Padres,Y,"$1,200,000 ",*Zach Eflin(minors),RHP,6.5,93.0,167.0,1.0,0.126,0.298,120.0,36.0,45.0,4.53,1.3,0.0,HS,"Paul J. Hagerty HS (Oviedo, FL)",0
2012,1s,,34,FrRnd,34,Athletics,Y,"$1,500,000 ",*Daniel Robertson(minors),SS,2.2,299.0,801.0,18.0,0.227,0.683,3.0,0.0,0.0,0.0,0.67,0.0,HS,"Upland HS (Upland, CA)",1
2012,1s,,35,FrRnd,35,Mets,Y,"$1,400,000 ",*Kevin Plawecki(minors),C,2.9,412.0,1173.0,22.0,0.232,0.655,7.0,0.0,0.0,4.7,0.91,0.0,4Yr,"Purdue University (West Lafayette, IN)",0
2012,1s,,36,FrRnd,36,Cardinals,Y,"$1,430,000 ",*Stephen Piscotty(minors),3B,7.0,703.0,2449.0,89.0,0.258,0.758,,,,,,,4Yr,"Stanford University (Palo Alto, CA)",1
2012,1s,,37,FrRnd,37,Red Sox,Y,"$1,000,000 ",*Pat Light(minors),RHP,-0.7,2.0,0.0,0.0,,,17.0,0.0,1.0,11.34,2.28,0.0,4Yr,"Monmouth University (West Long Branch, NJ)",0
2012,1s,,38,FrRnd,38,Brewers,Y,"$1,200,000 ",*Mitch Haniger(minors),OF,14.2,516.0,1975.0,104.0,0.262,0.818,,,,,,,4Yr,"California Polytechnic State University, San Luis Obispo (San Luis Obispo, CA)",0
2012,1s,,39,FrRnd,39,Rangers,Y,"$2,250,000 ",*Joey Gallo(minors),3B,14.3,692.0,2208.0,167.0,0.202,0.802,,,,,,,HS,"Bishop Gorman HS (Las Vegas, NV)",1
2012,1s,,40,FrRnd,40,Phillies,Y,"$1,291,300 ",*Shane Watson(minors),RHP,,,,,,,,,,,,,HS,"Lakewood HS (Lakewood, CA)",0
2012,1s,,41,FrRnd,41,Astros,Y,"$2,500,000 ",*Lance McCullers Jr.(minors),RHP,9.7,7.0,14.0,0.0,0.071,0.143,122.0,45.0,30.0,3.57,1.25,0.0,HS,"Jesuit HS (Tampa, FL)",0
2012,1s,,42,FrRnd,42,Twins,Y,"$1,227,000 ",*Luke Bard(minors),RHP,0.6,2.0,0.0,0.0,,,50.0,3.0,3.0,4.63,1.1,0.0,4Yr,"Georgia Institute of Technology (Atlanta, GA)",0
2012,1s,,43,FrRnd,43,Cubs,Y,"$1,196,000 ",*Pierce Johnson(minors),RHP,0.9,96.0,1.0,0.0,0.0,0.0,131.0,9.0,8.0,3.97,1.32,0.0,4Yr,"Missouri State University (Springfield, MO)",0
2012,1s,,44,FrRnd,44,Padres,Y,"$975,000 ",*Travis Jankowski(minors),OF,2.7,459.0,1058.0,9.0,0.238,0.634,,,,,,,4Yr,"State University of New York at Stony Brook (Stony Brook, NY)",0
2012,1s,,45,FrRnd,45,Pirates,Y,"$1,000,000 ",*Barrett Barnes(minors),OF,,,,,,,,,,,,,4Yr,"Texas Tech University (Lubbock, TX)",0
2012,1s,,46,FrRnd,46,Rockies,Y,"$1,000,000 ",*Eddie Butler(minors),RHP,-2.3,58.0,61.0,0.0,0.049,0.129,79.0,12.0,22.0,5.8,1.66,2.0,4Yr,"Radford University (Radford, VA)",0
2012,1s,,47,FrRnd,47,Athletics,Y,"$1,079,700 ",*Matt Olson(minors),1B,19.8,656.0,2357.0,154.0,0.252,0.853,,,,,,,HS,"Parkview HS (Lilburn, GA)",1
2012,1s,,48,FrRnd,48,White Sox,Y,"$950,000 ",*Keon Barnum(minors),1B,,,,,,,,,,,,,HS,"C. Leon King HS (Tampa, FL)",0
2012,1s,,49,FrRnd,49,Reds,Y,"$1,000,000 ",*Jesse Winker(minors),RF,5.2,492.0,1591.0,72.0,0.277,0.851,,,,,,,HS,"Olympia HS (Orlando, FL)",1
2012,1s,,50,FrRnd,50,Blue Jays,Y,"$2,000,000 ",*Matt Smoral(minors),LHP,,,,,,,,,,,,,HS,"Solon HS (Solon, OH)",0
2012,1s,,51,FrRnd,51,Dodgers,Y,"$984,700 ",*Jesmuel Valentin(minors),SS,-0.7,46.0,79.0,1.0,0.177,0.562,1.0,0.0,0.0,27.0,4.0,0.0,HS,"Puerto Rico Baseball Academy (Gurabo, Puerto Rico)",0
2012,1s,,52,FrRnd,52,Cardinals,Y,"$678,790 ",*Patrick Wisdom(minors),3B,3.3,225.0,690.0,49.0,0.229,0.794,,,,,,,4Yr,"Saint Mary's College of California (Moraga, CA)",1
2012,1s,,53,FrRnd,53,Rangers,Y,"$975,000 ",*Collin Wiles(minors),RHP,,,,,,,,,,,,,HS,"Blue Valley West HS (Stilwell, KS)",1
2012,1s,,54,FrRnd,54,Phillies,Y,"$940,200 ",*Mitch Gueller(minors),RHP,,,,,,,,,,,,,HS,"W. F. West HS (Chehalis, WA)",0
2012,1,,55,FrRnd,55,Padres,Y,"$2,000,000 ",*Walker Weickel(minors),RHP,,,,,,,,,,,,,HS,"Olympia HS (Orlando, FL)",0
2012,1s,,56,FrRnd,56,Cubs,Y,"$911,700 ",*Paul Blackburn(minors),RHP,2.4,2.0,5.0,0.0,0.0,0.0,46.0,12.0,14.0,4.64,1.36,0.0,HS,"Heritage HS (Brentwood, CA)",0
2012,1s,,57,FrRnd,57,Reds,Y,"$825,000 ",*Jeff Gelalich(minors),OF,,,,,,,,,,,,,4Yr,"University of California, Los Angeles (Los Angeles, CA)",1
2012,1s,,58,FrRnd,58,Blue Jays,Y,"$1,000,000 ",*Mitch Nay(minors),3B,,,,,,,,,,,,,HS,"Hamilton HS (Chandler, AZ)",0
2012,1s,,59,FrRnd,59,Cardinals,Y,"$700,000 ",*Steve Bean(minors),C,,,,,,,,,,,,,HS,"Rockwall HS (Rockwall, TX)",1
2012,1s,,60,FrRnd,60,Blue Jays,Y,"$750,000 ",*Tyler Gonzales(minors),RHP,,,,,,,,,,,,,HS,"James Madison HS (San Antonio, TX)",0
2013,1,,1,FrRnd,1,Astros,Y,"$6,350,000 ",Mark Appel(minors),RHP,0.1,0.0,0.0,,,,2.0,0.0,0.0,0.0,0.5,0.0,4Yr,"Stanford University (Palo Alto, CA)",0
2013,1,,2,FrRnd,2,Cubs,Y,"$6,708,400 ",Kris Bryant(minors),3B,28.5,907.0,3375.0,167.0,0.278,0.875,,,,,,,4Yr,"University of San Diego (San Diego, CA)",0
2013,1,,3,FrRnd,3,Rockies,Y,"$4,800,000 ",Jon Gray(minors),RHP,11.3,140.0,242.0,1.0,0.091,0.25,166.0,57.0,53.0,4.54,1.32,0.0,4Yr,"University of Oklahoma (Norman, OK)",0
2013,1,,4,FrRnd,4,Twins,Y,"$4,544,400 ",Kohl Stewart(minors),RHP,0.2,4.0,3.0,0.0,0.333,0.667,21.0,5.0,4.0,4.88,1.48,0.0,HS,"St. Pius X HS (Houston, TX)",0
2013,1,,5,FrRnd,5,Indians,Y,"$3,500,000 ",Jackson Frazier(minors),3B,0.2,247.0,744.0,29.0,0.238,0.756,,,,,,,HS,"Loganville HS (Loganville, GA)",1
2013,1,,6,FrRnd,6,Marlins,Y,"$3,516,500 ",Colin Moran(minors),3B,-0.2,497.0,1511.0,49.0,0.263,0.742,,,,,,,4Yr,"University of North Carolina at Chapel Hill (Chapel Hill, NC)",0
2013,1,,7,FrRnd,7,Red Sox,Y,"$2,750,000 ",Trey Ball(minors),LHP,,,,,,,,,,,,,HS,"New Castle Chrysler HS (New Castle, IN)",1
2013,1,,8,FrRnd,8,Royals,Y,"$2,200,000 ",Hunter Dozier(minors),SS,-1.4,506.0,1804.0,67.0,0.244,0.748,,,,,,,4Yr,"Stephen F. Austin State University (Nacogdoches, TX)",0
2013,1,,9,FrRnd,9,Pirates,Y,"$3,029,600 ",*Austin Meadows(minors),CF,6.7,411.0,1486.0,70.0,0.259,0.809,,,,,,,HS,"Grayson HS (Loganville, GA)",1
2013,1,,10,FrRnd,10,Blue Jays,N,,Phil Bickford(minors),RHP,0.9,57.0,3.0,0.0,0.333,0.667,85.0,4.0,3.0,3.84,1.1,1.0,HS,"Oaks Christian HS (Westlake, CA)",0
2013,1,,11,FrRnd,11,Mets,Y,"$2,600,000 ",Dominic Smith(minors),1B,0.6,437.0,1217.0,46.0,0.249,0.74,,,,,,,HS,"Junipero Serra HS (Gardena, CA)",0
2013,1,,12,FrRnd,12,Mariners,Y,"$2,759,100 ",D.J. Peterson(minors),3B,,,,,,,,,,,,,4Yr,"University of New Mexico (Albuquerque, NM)",0
2013,1,,13,FrRnd,13,Padres,Y,"$2,678,000 ",Hunter Renfroe(minors),RF,9.5,630.0,2164.0,141.0,0.238,0.787,,,,,,,4Yr,"Mississippi State University (Mississippi State, MS)",0
2013,1,,14,FrRnd,14,Pirates,Y,"$2,369,800 ",Reese McGuire(minors),C,1.6,186.0,495.0,9.0,0.24,0.647,,,,,,,HS,"Kentwood HS (Covington, WA)",1
2013,1,,15,FrRnd,15,Diamondbacks,Y,"$2,250,000 ",Braden Shipley(minors),RHP,-0.1,25.0,34.0,0.0,0.088,0.206,26.0,4.0,6.0,5.49,1.6,0.0,4Yr,"University of Nevada, Reno (Reno, NV)",0
2013,1,,16,FrRnd,16,Phillies,Y,"$2,299,300 ",J.P. Crawford(minors),SS,10.4,451.0,1628.0,26.0,0.253,0.703,,,,,,,HS,"Lakewood HS (Lakewood, CA)",0
2013,1,,17,FrRnd,17,White Sox,Y,"$2,164,000 ",Tim Anderson(minors),SS,18.6,745.0,3015.0,96.0,0.289,0.765,,,,,,,JC,"East Central Community College (Decatur, MS)",0
2013,1,,18,FrRnd,18,Dodgers,Y,"$2,109,900 ",Chris Anderson(minors),RHP,,,,,,,,,,,,,4Yr,"Jacksonville University (Jacksonville, FL)",1
2013,1,,19,FrRnd,19,Cardinals,Y,"$1,850,000 ",Marco Gonzales(minors),LHP,9.7,18.0,23.0,0.0,0.217,0.565,137.0,55.0,42.0,3.97,1.27,0.0,4Yr,"Gonzaga University (Spokane, WA)",1
2013,1,,20,FrRnd,20,Tigers,Y,"$2,001,700 ",Jonathon Crawford(minors),RHP,,,,,,,,,,,,,4Yr,"University of Florida (Gainesville, FL)",1
2013,1,,21,FrRnd,21,Rays,Y,"$1,972,200 ",Nick Ciuffo(minors),C,-0.2,21.0,48.0,1.0,0.188,0.551,,,,,,,HS,"Lexington HS (Lexington, SC)",1
2013,1,,22,FrRnd,22,Orioles,Y,"$1,947,600 ",Hunter Harvey(minors),RHP,0.6,1.0,0.0,0.0,,,30.0,1.0,2.0,3.08,1.14,0.0,HS,"Bandys HS (Catawba, NC)",0
2013,1,,23,FrRnd,23,Rangers,Y,"$2,215,000 ",Chi Chi Gonzalez(minors),RHP,-0.2,37.0,55.0,0.0,0.109,0.252,66.0,9.0,24.0,5.66,1.48,0.0,4Yr,"Oral Roberts University (Tulsa, OK)",0
2013,1,,24,FrRnd,24,Athletics,Y,"$1,800,000 ",Billy McKinney(minors),CF,-0.3,263.0,690.0,28.0,0.206,0.664,,,,,,,HS,"Plano West Senior HS (Plano, TX)",1
2013,1,,25,FrRnd,25,Giants,Y,"$1,866,500 ",Christian Arroyo(minors),SS,1.3,181.0,547.0,19.0,0.234,0.685,1.0,0.0,0.0,0.0,2.0,0.0,HS,"Hernando HS (Brooksville, FL)",0
2013,1,,26,FrRnd,26,Yankees,Y,"$1,839,400 ",Eric Jagielo(minors),3B,,,,,,,,,,,,,4Yr,"University of Notre Dame (South Bend, IN)",0
2013,1,,27,FrRnd,27,Reds,Y,"$1,812,400 ",Phil Ervin(minors),CF,0.4,237.0,586.0,17.0,0.247,0.728,1.0,0.0,0.0,0.0,0.0,0.0,4Yr,"Samford University (Homewood, AL)",1
2013,1,,28,FrRnd,28,Cardinals via Brewers,Y,"$1,785,300 ",*Rob Kaminsky(minors),LHP,-0.1,0.0,0.0,0.0,,,5.0,0.0,0.0,1.93,1.07,0.0,HS,"St. Joseph Regional HS (Montvale, NJ)",1
2013,1,,29,FrRnd,29,Rays via Braves,Y,"$1,755,800 ",*Ryne Stanek(minors),RHP,3.1,35.0,0.0,0.0,,,254.0,6.0,12.0,3.52,1.27,4.0,4Yr,"University of Arkansas (Fayetteville, AR)",1
2013,1,,30,FrRnd,30,Rangers via Angels,Y,"$1,900,000 ",*Travis Demeritte(minors),SS,-1.8,92.0,287.0,6.0,0.216,0.605,1.0,0.0,0.0,36.0,4.0,0.0,HS,"Winder-Barrow HS (Winder, GA)",0
2013,1,,31,FrRnd,31,Braves via Indians,Y,"$1,704,200 ",*Jason Hursh(minors),RHP,-0.2,11.0,0.0,0.0,,,11.0,1.0,0.0,8.25,2.0,0.0,4Yr,"Oklahoma State University (Stillwater, OK)",1
2013,1,,32,FrRnd,32,Yankees via Indians,Y,"$1,800,000 ",*Aaron Judge(minors),CF,29.9,650.0,2362.0,187.0,0.277,0.945,,,,,,,4Yr,"California State University, Fresno (Fresno, CA)",0
2013,1,,33,FrRnd,33,Yankees via Nationals,Y,"$1,650,100 ",*Ian Clarkin(minors),LHP,,,,,,,,,,,,,HS,"Madison HS (San Diego, CA)",0
2013,1,,34,FrRnd,34,Royals,Y,"$3,550,000 ",Sean Manaea(minors),LHP,12.8,8.0,14.0,0.0,0.214,0.552,144.0,53.0,45.0,3.9,1.21,0.0,4Yr,"Indiana State University (Terre Haute, IN)",0
2013,1,,35,FrRnd,35,Marlins,N,,Matt Krook(minors),LHP,,,,,,,,,,,,,HS,"St. Ignatius College Preparatory (San Francisco, CA)",0
2013,1,,36,FrRnd,36,Diamondbacks,Y,"$1,435,000 ",Aaron Blair(minors),RHP,-2.0,16.0,22.0,0.0,0.091,0.221,16.0,2.0,8.0,7.89,1.73,0.0,4Yr,"Marshall University (Huntington, WV)",0
2013,1,,37,FrRnd,37,Orioles,Y,"$1,450,000 ",Josh Hart(minors),CF,,,,,,,,,,,,,HS,"Parkview HS (Lilburn, GA)",0
2013,1,,38,FrRnd,38,Reds,Y,"$1,500,000 ",Michael Lorenzen(minors),RHP,6.6,321.0,133.0,7.0,0.233,0.71,308.0,29.0,29.0,4.18,1.37,14.0,4Yr,"California State University, Fullerton (Fullerton, CA)",1
2013,1,,39,FrRnd,39,Tigers,Y,"$1,433,400 ",Corey Knebel(minors),RHP,5.4,231.0,2.0,0.0,0.0,0.0,300.0,12.0,16.0,3.23,1.23,71.0,4Yr,"University of Texas at Austin (Austin, TX)",1
2014,1,,1,FrRnd,1,Astros,N,,Brady Aiken(minors),LHP,,,,,,,,,,,,,HS,"Cathedral Catholic HS (San Diego, CA)",0
2014,1,,2,FrRnd,2,Marlins,Y,"$6,000,000 ",Tyler Kolek(minors),RHP,,,,,,,,,,,,,HS,"Shepherd HS (Shepherd, TX)",0
2014,1,,3,FrRnd,3,White Sox,Y,"$6,582,000 ",Carlos Rodon(minors),LHP,14.0,8.0,13.0,0.0,0.154,0.385,137.0,49.0,43.0,3.68,1.27,0.0,4Yr,"North Carolina State University (Raleigh, NC)",0
2014,1,,4,FrRnd,4,Cubs,Y,"$3,125,000 ",Kyle Schwarber(minors),C,10.4,742.0,2494.0,176.0,0.234,0.835,,,,,,,4Yr,"Indiana University Bloomington (Bloomington, IN)",0
2014,1,,5,FrRnd,5,Twins,Y,"$3,851,000 ",Nick Gordon(minors),SS,0.8,136.0,370.0,8.0,0.254,0.684,1.0,0.0,0.0,0.0,1.0,0.0,HS,"Olympia HS (Orlando, FL)",0
2014,1,,6,FrRnd,6,Mariners,Y,"$4,200,000 ",Alex Jackson(minors),OF,-0.9,66.0,163.0,3.0,0.141,0.47,,,,,,,HS,"Rancho Bernardo HS (San Diego, CA)",0
2014,1,,7,FrRnd,7,Phillies,Y,"$3,300,900 ",Aaron Nola(minors),RHP,26.9,152.0,271.0,0.0,0.089,0.267,187.0,72.0,54.0,3.63,1.14,0.0,4Yr,"Louisiana State University (Baton Rouge, LA)",0
2014,1,,8,FrRnd,8,Rockies,Y,"$2,300,000 ",Kyle Freeland(minors),LHP,15.2,105.0,173.0,1.0,0.127,0.332,140.0,44.0,46.0,4.23,1.4,0.0,4Yr,"University of Evansville (Evansville, IN)",0
2014,1,,9,FrRnd,9,Blue Jays,Y,"$3,080,800 ",Jeff Hoffman(minors),RHP,-0.3,86.0,77.0,0.0,0.13,0.273,127.0,14.0,21.0,5.68,1.58,1.0,4Yr,"East Carolina University (Greenville, NC)",0
2014,1,,10,FrRnd,10,Mets,Y,"$2,970,800 ",Michael Conforto(minors),OF,15.7,757.0,2551.0,132.0,0.255,0.824,,,,,,,4Yr,"Oregon State University (Corvallis, OR)",0
2014,1,,11,FrRnd,11,Blue Jays,Y,"$2,888,300 ",Max Pentecost(minors),C,,,,,,,,,,,,,4Yr,"Kennesaw State University (Kennesaw, GA)",0
