Year,Rnd,RdPck,Tm,Signed,Bonus,Name,Pos,WAR,G,AB,HR,BA,OPS,Type,Drafted Out of,Team Made Playoffs
2000,1,1,Marlins,Y,3000000.0,Adrian Gonzalez,1B,43.5,1929.0,7139.0,317.0,0.287,0.843,HS,"Eastlake HS (Chula Vista, CA)",0
2000,1,3,Cubs,Y,2750000.0,Luis Montanez,SS,-1.3,129.0,305.0,5.0,0.223,0.586,HS,"Coral Park HS (Miami, FL)",0
2000,1,6,Devil Rays,Y,2250000.0,Rocco Baldelli,OF,10.2,519.0,1910.0,60.0,0.278,0.766,HS,"Bishop Hendricken HS (Warwick, RI)",0
2000,1,11,Brewers,Y,1950000.0,Dave Krynzel,OF,0.2,21.0,48.0,0.0,0.188,0.486,HS,"Green Valley HS (Henderson, NV)",0
2000,1,12,White Sox,Y,5300000.0,Joe Borchard,OF,-1.5,301.0,716.0,26.0,0.205,0.636,4Yr,"Stanford University (Palo Alto, CA)",1
2000,1,13,Cardinals,Y,1750000.0,Shaun Boyd,OF,0.0,0.0,0.0,0.0,0.0,0.0,HS,"Vista HS (Vista, CA)",1
2000,1,15,Phillies,Y,1780000.0,Chase Utley,2B,64.5,1937.0,6857.0,259.0,0.275,0.823,4Yr,"University of California, Los Angeles (Los Angeles, CA)",0
2000,1,18,Blue Jays,Y,950000.0,Miguel Negron,OF,0.0,0.0,0.0,0.0,0.0,0.0,HS,"Manuela Toro HS (Caguas, Puerto Rico)",0
2000,1,23,Reds,Y,0.0,David Espinosa,SS,0.0,0.0,0.0,0.0,0.0,0.0,HS,"Gulliver Prep HS (Coral Gables, FL)",0
2000,1,25,Rangers ,Y,1475000.0,Scott Heard,C,0.0,0.0,0.0,0.0,0.0,0.0,HS,"Rancho Bernardo HS (San Diego, CA)",0
2000,1,26,Indians,Y,1375000.0,Corey Smith,SS,0.0,0.0,0.0,0.0,0.0,0.0,HS,"Piscataway HS (Piscataway, NJ)",0
2000,1,28,Yankees,Y,1425000.0,Dave Parrish,C,0.0,0.0,0.0,0.0,0.0,0.0,4Yr,"University of Michigan (Ann Arbor, MI)",1
2000,1,30,Braves,Y,1225000.0,Scott Thorman,3B,-1.0,175.0,415.0,16.0,0.222,0.667,HS,"Preston HS (Cambridge, ON)",1
2000,1,35,Rangers,N,0.0,Tyrell Godwin,OF,0.0,3.0,3.0,0.0,0.0,0.0,4Yr,"University of North Carolina at Chapel Hill (Chapel Hill, NC)",0
2000,1,38,Braves,Y,790000.0,Kelly Johnson,SS,16.6,1399.0,4543.0,155.0,0.251,0.751,HS,"Westwood HS (Austin, TX)",1
2000,1,40,Braves,Y,850000.0,Aaron Herr,SS,0.0,0.0,0.0,0.0,0.0,0.0,HS,"Hempfield HS (Landisville, PA)",1
2001,1,1,Twins,Y,5150000.0,Joe Mauer,C,55.2,1858.0,6930.0,143.0,0.306,0.827,HS,"Cretin HS (St. Paul, MN)",0
2001,1,5,Rangers,Y,4500000.0,Mark Teixeira,3B,50.6,1862.0,6936.0,409.0,0.269,0.87,4Yr,"Georgia Institute of Technology (Atlanta, GA)",0
2001,1,10,Astros,Y,2125000.0,Chris Burke,2B,-1.2,477.0,1267.0,23.0,0.239,0.674,4Yr,"University of Tennessee (Knoxville, TN)",1
2001,1,13,Angels,Y,2075000.0,Casey Kotchman,1B,7.5,939.0,3071.0,71.0,0.26,0.711,HS,"Seminole HS (Seminole, FL)",0
2001,1,14,Padres,Y,1875000.0,Jake Gautreau,3B,0.0,0.0,0.0,0.0,0.0,0.0,4Yr,"Tulane University (New Orleans, LA)",0
2001,1,15,Blue Jays,Y,1865000.0,Gabe Gross,OF,4.6,657.0,1461.0,40.0,0.239,0.716,4Yr,"Auburn University (Auburn, AL)",0
2001,1,19,Orioles ,Y,1300000.0,Mike Fontenot,2B,4.2,582.0,1413.0,27.0,0.265,0.734,4Yr,"Louisiana State University (Baton Rouge, LA)",0
2001,1,23,Yankees ,Y,1200000.0,John-Ford Griffin,OF,0.2,13.0,23.0,2.0,0.304,1.066,4Yr,"Florida State University (Tallahassee, FL)",1
2001,1,25,Athletics,Y,1350000.0,Bobby Crosby,SS,5.4,747.0,2559.0,62.0,0.236,0.677,4Yr,"California State University, Long Beach (Long Beach, CA)",1
2001,1,29,Braves,Y,1250000.0,Josh Burrus,SS,0.0,0.0,0.0,0.0,0.0,0.0,HS,"Wheeler HS (Marietta, GA)",1
2001,1,31,Orioles,Y,1150000.0,Bryan Bass,SS,0.0,0.0,0.0,0.0,0.0,0.0,HS,"Seminole HS (Seminole, FL)",0
2001,1,32,Tigers,Y,1100000.0,Michael Woods,2B,0.0,0.0,0.0,0.0,0.0,0.0,4Yr,"Southern University and A&M College (Baton Rouge, LA)",0
2001,1,33,Angels,Y,850000.0,Jeff Mathis,C,0.2,948.0,2718.0,53.0,0.194,0.551,HS,"Marianna HS (Marianna, FL)",0
2001,1,34,Yankees,Y,1000000.0,Bronson Sardinha,SS,0.0,10.0,9.0,0.0,0.333,0.75,HS,"Kamehameha HS (Honolulu, HI)",1
2001,1,36,Mariners,Y,2000000.0,Michael Garciaparra,SS,0.0,0.0,0.0,0.0,0.0,0.0,HS,"Don Bosco Technical Institute (Rosemead, CA)",1
2001,1,38,Mets,Y,960000.0,David Wright,3B,49.2,1585.0,5998.0,242.0,0.296,0.867,HS,"Hickory HS (Chesapeake, VA)",0
2001,1,40,Braves,Y,850000.0,Richard Lewis,2B,0.0,0.0,0.0,0.0,0.0,0.0,4Yr,"Georgia Institute of Technology (Atlanta, GA)",1
2001,1,41,Giants,Y,750000.0,Todd Linden,OF,-1.8,270.0,502.0,8.0,0.231,0.638,4Yr,"Louisiana State University (Baton Rouge, LA)",0
2001,1,43,Indians,Y,870000.0,Mike Conroy,OF,0.0,0.0,0.0,0.0,0.0,0.0,HS,"Boston College HS (Boston, MA)",1
2001,1,44,Rockies,Y,925000.0,Jayson Nix,SS,1.6,466.0,1305.0,38.0,0.212,0.627,HS,"Midland HS (Midland, TX)",0
2002,1,2,Devil Rays,Y,4600000.0,B.J. Upton,SS,16.8,1469.0,5175.0,164.0,0.244,0.723,HS,"Greenbrier Christian Academy (Chesapeake, VA)",0
2002,1,7,Brewers,Y,2400000.0,Prince Fielder,1B,23.8,1611.0,5821.0,319.0,0.283,0.887,HS,"Eau Gallie HS (Melbourne, FL)",0
2002,1,8,Tigers,Y,2300000.0,Scott Moore,SS,-0.8,152.0,385.0,16.0,0.242,0.713,HS,"Cypress HS (Cypress, CA)",0
2002,1,10,Rangers,Y,1875000.0,Drew Meyer,SS,-0.3,5.0,14.0,0.0,0.214,0.429,4Yr,"University of South Carolina (Columbia, SC)",0
2002,1,11,Marlins,Y,2012500.0,Jeremy Hermida,OF,2.7,632.0,2012.0,65.0,0.257,0.749,HS,"Wheeler HS (Marietta, GA)",0
2002,1,13,Padres,Y,1500000.0,Khalil Greene,SS,8.5,736.0,2567.0,90.0,0.245,0.723,4Yr,"Clemson University (Clemson, SC)",0
2002,1,14,Blue Jays,Y,1785000.0,Russ Adams,SS,0.0,286.0,884.0,17.0,0.247,0.685,4Yr,"University of North Carolina at Chapel Hill (Chapel Hill, NC)",0
2002,1,16,Athletics ,Y,1780000.0,Nick Swisher,1B,21.5,1527.0,5369.0,245.0,0.249,0.799,4Yr,"The Ohio State University (Columbus, OH)",1
2002,1,19,Dodgers,Y,1500000.0,James Loney,1B,11.3,1443.0,5023.0,108.0,0.284,0.746,HS,"Lawrence E Elkins HS (Missouri City, TX)",0
2002,1,20,Twins,Y,1700000.0,Denard Span,OF,27.9,1359.0,5326.0,71.0,0.281,0.745,HS,"Tampa Catholic HS (Tampa, FL)",1
2002,1,23,Braves,Y,2200000.0,Jeff Francoeur,OF,6.8,1480.0,5260.0,160.0,0.261,0.72,HS,"Parkview HS (Lilburn, GA)",1
2002,1,26,Athletics,Y,1375000.0,John McCurdy,SS,0.0,0.0,0.0,0.0,0.0,0.0,4Yr,"University of Maryland (College Park, MD)",1
2002,1,27,Diamondbacks,Y,1400000.0,Sergio Santos,SS,2.0,27.0,1.0,0.0,0.0,0.0,HS,"Mater Dei HS (Santa Ana, CA)",1
2002,1,28,Mariners,N,0.0,John Mayberry,OF,1.5,574.0,1386.0,56.0,0.235,0.72,HS,"Rockhurst HS (Kansas City, MO)",0
2002,1,33,Indians,Y,1125000.0,Matt Whitney,3B,0.0,0.0,0.0,0.0,0.0,0.0,HS,"Palm Beach Gardens HS (Palm Beach Gardens, FL)",0
2002,1,35,Athletics,Y,350000.0,Jeremy Brown,C,0.1,5.0,10.0,0.0,0.3,0.864,4Yr,"University of Alabama (Tuscaloosa, AL)",1
2002,1,39,Athletics,Y,725000.0,Mark Teahen,3B,2.6,831.0,2873.0,67.0,0.264,0.736,4Yr,"Saint Mary's College of California (Moraga, CA)",1
2002,1,40,Reds,Y,200000.0,Mark Schramek,3B,0.0,0.0,0.0,0.0,0.0,0.0,4Yr,"University of Texas at San Antonio (San Antonio, TX)",0
2002,1,41,Indians,Y,915000.0,Micah Schilling,2B,0.0,0.0,0.0,0.0,0.0,0.0,HS,"Silliman Institute (Clinton, LA)",0
2003,1,1,Devil Rays,Y,3700000.0,Delmon Young,OF,3.2,1118.0,4108.0,109.0,0.283,0.737,HS,"Adolfo Camarillo HS (Camarillo, CA)",0
2003,1,2,Brewers,Y,3600000.0,Rickie Weeks,2B,11.5,1324.0,4417.0,161.0,0.246,0.764,4Yr,"Southern University and A&M College (Baton Rouge, LA)",0
2003,1,5,Royals,Y,2100000.0,Chris Lubanski,OF,0.0,0.0,0.0,0.0,0.0,0.0,HS,"Kennedy-Kenrick Catholic HS (Norristown, PA)",0
2003,1,6,Cubs,Y,2400000.0,Ryan Harvey,OF,0.0,0.0,0.0,0.0,0.0,0.0,HS,"Dunedin HS (Dunedin, FL)",1
2003,1,7,Orioles,Y,1850000.0,Nick Markakis,OF,33.6,2154.0,8302.0,189.0,0.288,0.781,JC,"Young Harris College (Young Harris, GA)",0
2003,1,10,Rockies,Y,1950000.0,Ian Stewart,3B,3.3,511.0,1489.0,61.0,0.229,0.73,HS,"La Quinta HS (Westminster, CA)",0
2003,1,11,Indians,Y,2010000.0,Michael Aubrey,1B,0.2,46.0,135.0,6.0,0.259,0.755,4Yr,"Tulane University (New Orleans, LA)",0
2003,1,12,Mets,Y,2075000.0,Lastings Milledge,OF,0.5,433.0,1500.0,33.0,0.269,0.723,HS,"Lakewood Ranch HS (Bradenton, FL)",0
2003,1,13,Blue Jays,Y,1675000.0,Aaron Hill,SS,24.4,1559.0,5646.0,162.0,0.266,0.74,4Yr,"Louisiana State University (Baton Rouge, LA)",0
2003,1,15,White Sox,Y,1600000.0,Brian Anderson,OF,-0.2,355.0,799.0,22.0,0.227,0.661,4Yr,"University of Arizona (Tucson, AZ)",0
2003,1,17,Red Sox,Y,1525000.0,David Murphy,OF,9.9,1110.0,3467.0,104.0,0.274,0.765,4Yr,"Baylor University (Waco, TX)",1
2003,1,18,Indians ,Y,1525000.0,Brad Snyder,OF,-0.1,30.0,66.0,2.0,0.167,0.513,4Yr,"Ball State University (Muncie, IN)",0
2003,1,19,Diamondbacks ,Y,1500000.0,Conor Jackson,1B,2.2,658.0,2184.0,52.0,0.271,0.757,4Yr,"University of California, Berkeley (Berkeley, CA)",0
2003,1,21,Twins,Y,1450000.0,Matt Moses,3B,0.0,0.0,0.0,0.0,0.0,0.0,HS,"Mills E. Godwin HS (Henrico, VA)",1
2003,1,23,Angels,Y,1300000.0,Brandon Wood,SS,-3.8,272.0,700.0,18.0,0.186,0.513,HS,"Horizon HS (Scottsdale, AZ)",0
2003,1,26,Athletics ,Y,1325000.0,Brian Snyder,3B,0.0,0.0,0.0,0.0,0.0,0.0,4Yr,"Stetson University (DeLand, FL)",1
2003,1,27,Yankees,Y,1250000.0,Eric Duncan,3B,0.0,0.0,0.0,0.0,0.0,0.0,HS,"Seton Hall Preparatory School (West Orange, NJ)",1
2003,1,28,Cardinals,Y,975000.0,Daric Barton,C,8.9,551.0,1744.0,30.0,0.247,0.721,HS,"Marina HS (Huntington Beach, CA)",0
2003,1,29,Diamondbacks,Y,1100000.0,Carlos Quentin,OF,10.5,834.0,2790.0,154.0,0.252,0.831,4Yr,"Stanford University (Palo Alto, CA)",0
2003,1,30,Royals ,Y,900000.0,Mitch Maier,C,1.5,359.0,977.0,10.0,0.248,0.671,4Yr,"University of Toledo (Toledo, OH)",0
2003,1,32,Red Sox,Y,1010000.0,Matt Murton,OF,3.3,346.0,952.0,29.0,0.286,0.788,4Yr,"Georgia Institute of Technology (Atlanta, GA)",1
2003,1,33,Athletics,Y,992500.0,Omar Quintanilla,SS,-0.9,402.0,1035.0,8.0,0.22,0.582,4Yr,"University of Texas at Austin (Austin, TX)",1
2003,1,36,Braves,Y,950000.0,Jarrod Saltalamacchia,C,5.9,895.0,2852.0,110.0,0.232,0.715,HS,"Royal Palm Beach HS (Royal Palm Beach, FL)",1
2003,1,37,Mariners,Y,925000.0,Adam Jones,SS,32.6,1823.0,7009.0,282.0,0.277,0.771,HS,"Samuel F. B. Morse HS (San Diego, CA)",0
2004,1,1,Padres,Y,3150000.0,Matt Bush,SS,2.6,8.0,0.0,0.0,0.0,0.0,HS,"Mission Bay HS (San Diego, CA)",0
2004,1,9,Rockies,Y,2150000.0,Chris Nelson,SS,-2.6,282.0,834.0,16.0,0.265,0.699,HS,"Redan HS (Stone Mountain, GA)",0
2004,1,11,Pirates,Y,1950000.0,Neil Walker,C,19.6,1306.0,4583.0,149.0,0.267,0.764,HS,"Pine-Richland HS (Gibsonia, PA)",0
2004,1,14,Royals,Y,1450000.0,Billy Butler,3B,11.9,1414.0,5105.0,147.0,0.29,0.795,HS,"Wolfson HS (Jacksonville, FL)",0
2004,1,15,Diamondbacks,Y,4000000.0,Stephen Drew,SS,15.9,1268.0,4403.0,123.0,0.252,0.741,4Yr,"Florida State University (Tallahassee, FL)",0
2004,1,18,White Sox,Y,1550000.0,Josh Fields,3B,-1.1,217.0,713.0,34.0,0.234,0.724,4Yr,"Oklahoma State University (Stillwater, OK)",0
2004,1,20,Twins,Y,1500000.0,Trevor Plouffe,SS,7.3,830.0,2933.0,106.0,0.242,0.714,HS,"Crespi Carmelite HS (Encino, CA)",1
2004,1,21,Phillies,Y,1475000.0,Greg Golson,OF,-0.6,40.0,41.0,0.0,0.195,0.458,HS,"John B. Connally HS (Austin, TX)",0
2004,1,24,Athletics ,Y,1000000.0,Landon Powell,C,0.2,123.0,363.0,10.0,0.207,0.612,4Yr,"University of South Carolina (Columbia, SC)",0
2004,1,26,Athletics,Y,1325000.0,Richie Robnett,OF,0.0,0.0,0.0,0.0,0.0,0.0,4Yr,"California State University, Fresno (Fresno, CA)",0
2004,1,28,Dodgers ,Y,1200000.0,Blake DeWitt,2B,1.9,426.0,1119.0,21.0,0.257,0.705,HS,"Sikeston HS (Sikeston, MO)",1
2004,1,29,Royals ,Y,1100000.0,Matt Campbell,lHP,0.0,0.0,0.0,0.0,0.0,0.0,4Yr,"University of South Carolina (Columbia, SC)",0
2004,1,36,Athletics,Y,950000.0,Danny Putnam,OF,-0.2,11.0,28.0,1.0,0.214,0.612,4Yr,"Stanford University (Palo Alto, CA)",0
2004,1,37,Yankees,Y,925000.0,Jon Poterson,C,0.0,0.0,0.0,0.0,0.0,0.0,HS,"Chandler HS (Chandler, AZ)",1
2004,1,38,White Sox,Y,850000.0,Gio Gonzalez,lHP,28.3,221.0,410.0,3.0,0.09,0.247,HS,"Monsignor Edward Pace HS (Miami Gardens, FL)",0
2005,1,1,Diamondbacks,Y,6100000.0,Justin Upton,SS,32.3,1842.0,6714.0,325.0,0.261,0.812,HS,"Great Bridge HS (Chesapeake, VA)",0
2005,1,2,Royals,Y,4000000.0,Alex Gordon,3B,34.4,1753.0,6391.0,190.0,0.257,0.749,4Yr,"University of Nebraska-Lincoln (Lincoln, NE)",0
2005,1,3,Mariners,Y,3400000.0,Jeff Clement,C,-1.2,152.0,385.0,14.0,0.218,0.648,4Yr,"University of Southern California (Los Angeles, CA)",0
2005,1,4,Nationals,Y,2975000.0,Ryan Zimmerman,3B,40.1,1799.0,6654.0,284.0,0.277,0.816,4Yr,"University of Virginia (Charlottesville, VA)",0
2005,1,5,Brewers,Y,2450000.0,Ryan Braun,3B,47.1,1766.0,6622.0,352.0,0.296,0.891,4Yr,"University of Miami (Coral Gables, FL)",0
2005,1,7,Rockies,Y,2300000.0,Troy Tulowitzki,SS,44.5,1291.0,4804.0,225.0,0.29,0.856,4Yr,"California State University, Long Beach (Long Beach, CA)",0
2005,1,10,Tigers,Y,2650000.0,Cameron Maybin,OF,13.5,1162.0,3824.0,72.0,0.254,0.697,HS,"T. C. Roberson HS (Asheville, NC)",0
2005,1,11,Pirates,Y,1900000.0,Andrew McCutchen,OF,46.1,1828.0,6786.0,277.0,0.279,0.843,HS,"Fort Meade HS (Fort Meade, FL)",0
2005,1,12,Reds,Y,1800000.0,Jay Bruce,OF,19.9,1650.0,5964.0,319.0,0.244,0.781,HS,"West Brook HS (Beaumont, TX)",0
2005,1,13,Orioles,Y,1700000.0,Brandon Snyder,C,-0.1,122.0,200.0,9.0,0.24,0.731,HS,"Westfield HS (Chantilly, VA)",0
2005,1,14,Indians,Y,1695000.0,Trevor Crowe,OF,0.2,265.0,818.0,4.0,0.24,0.615,4Yr,"University of Arizona (Tucson, AZ)",0
2005,1,17,Yankees ,Y,1575000.0,C.J. Henry,SS,0.0,0.0,0.0,0.0,0.0,0.0,HS,"Putnam City HS (Oklahoma City, OK)",1
2005,1,19,Rangers,Y,1525000.0,John Mayberry,OF,1.5,574.0,1386.0,56.0,0.235,0.72,4Yr,"Stanford University (Palo Alto, CA)",0
2005,1,21,Athletics,Y,1475000.0,Cliff Pennington,SS,10.1,971.0,2799.0,36.0,0.242,0.648,4Yr,"Texas A&M University (College Station, TX)",0
2005,1,23,Red Sox ,Y,1400000.0,Jacoby Ellsbury,OF,31.2,1235.0,4846.0,104.0,0.284,0.76,4Yr,"Oregon State University (Corvallis, OR)",1
2005,1,28,Cardinals ,Y,1000000.0,Colby Rasmus,OF,20.2,1092.0,3704.0,166.0,0.241,0.745,HS,"Russell County HS (Seale, AL)",1
2005,1,30,Cardinals,Y,1100000.0,Tyler Greene,SS,-0.4,288.0,675.0,17.0,0.224,0.645,4Yr,"Georgia Institute of Technology (Atlanta, GA)",1
2005,1,33,Indians,Y,1000000.0,Johnny Drennen,OF,0.0,0.0,0.0,0.0,0.0,0.0,HS,"Rancho Bernardo HS (San Diego, CA)",0
2005,1,36,Athletics,Y,950000.0,Travis Buck,OF,2.8,253.0,810.0,20.0,0.243,0.715,4Yr,"Arizona State University (Tempe, AZ)",0
2005,1,38,Astros,Y,900000.0,Eli Iorg,OF,0.0,0.0,0.0,0.0,0.0,0.0,4Yr,"University of Tennessee (Knoxville, TN)",1
2005,1,39,Twins,Y,900000.0,Hank Sanchez,1B,0.0,0.0,0.0,0.0,0.0,0.0,HS,"Mission Bay HS (San Diego, CA)",0
2005,1,45,Red Sox,Y,762000.0,Jed Lowrie,2B,16.0,1303.0,4599.0,121.0,0.257,0.737,4Yr,"Stanford University (Palo Alto, CA)",1
2006,1,3,Devil Rays,Y,3000000.0,Evan Longoria,3B,57.6,1866.0,6958.0,325.0,0.266,0.808,4Yr,"California State University, Long Beach (Long Beach, CA)",0
2006,1,8,Reds,Y,2000000.0,Drew Stubbs,OF,7.9,911.0,2834.0,92.0,0.242,0.704,4Yr,"University of Texas at Austin (Austin, TX)",0
2006,1,9,Orioles,Y,2100000.0,Billy Rowell,3B,0.0,0.0,0.0,0.0,0.0,0.0,HS,"Bishop Eustace Preparatory School (Pennsauken, NJ)",0
2006,1,13,Cubs,Y,1475000.0,Tyler Colvin,OF,0.9,441.0,1215.0,49.0,0.239,0.733,4Yr,"Clemson University (Clemson, SC)",0
2006,1,14,Blue Jays,Y,1700000.0,Travis Snider,OF,4.3,630.0,1783.0,54.0,0.244,0.709,HS,"Henry M. Jackson HS (Mill Creek, WA)",0
2006,1,15,Nationals,Y,1625000.0,Chris Marrero,OF,-1.5,54.0,163.0,1.0,0.209,0.493,HS,"Monsignor Edward Pace HS (Miami Gardens, FL)",0
2006,1,17,Padres,Y,1575000.0,Matt Antonelli,3B,-0.3,21.0,57.0,1.0,0.193,0.573,4Yr,"Wake Forest University (Winston-Salem, NC)",1
2006,1,20,Twins,Y,1500000.0,Chris Parmelee,OF,0.0,311.0,917.0,30.0,0.248,0.717,HS,"Chino Hills HS (Chino Hills, CA)",1
2006,1,23,Astros,Y,1400000.0,Maxwell Sapp,C,0.0,0.0,0.0,0.0,0.0,0.0,HS,"Bishop Moore HS (Orlando, FL)",0
2006,1,24,Braves,Y,1375000.0,Cody Johnson,OF,0.0,0.0,0.0,0.0,0.0,0.0,HS,"A. Crawford Mosley HS (Lynn Haven, FL)",0
2006,1,25,Angels ,Y,1350000.0,Hank Conger,C,2.0,373.0,1013.0,31.0,0.221,0.66,HS,"Huntington Beach HS (Huntington Beach, CA)",0
2006,1,27,Red Sox,Y,1300000.0,Jason Place,OF,0.0,0.0,0.0,0.0,0.0,0.0,HS,"Wren HS (Piedmont, SC)",0
2006,1,31,Dodgers,Y,1000000.0,Preston Mattingly,SS,0.0,0.0,0.0,0.0,0.0,0.0,HS,"Central HS (Evansville, IN)",1
2006,1,33,Giants,Y,1000000.0,Emmanuel Burriss,SS,-2.7,325.0,768.0,1.0,0.237,0.565,4Yr,"Kent State University (Kent, OH)",0
2006,1,35,Padres,Y,950000.0,Kyler Burke,OF,0.0,0.0,0.0,0.0,0.0,0.0,HS,"Ooltewah HS (Ooltewah, TN)",1
2006,1,36,Marlins,Y,950000.0,Chris Coghlan,3B,1.1,801.0,2580.0,53.0,0.258,0.731,4Yr,"University of Mississippi (Oxford, MS)",0
2006,1,37,Phillies,Y,925000.0,Adrian Cardenas,SS,-0.3,45.0,60.0,0.0,0.183,0.552,HS,"Monsignor Edward Pace HS (Miami Gardens, FL)",0
2007,1,2,Royals,Y,4000000.0,Mike Moustakas,SS,13.2,1291.0,4633.0,199.0,0.248,0.744,HS,"Chatsworth Charter HS (Chatsworth, CA)",0
2007,1,3,Cubs,Y,3200000.0,Josh Vitters,3B,-1.3,36.0,99.0,2.0,0.121,0.395,HS,"Cypress HS (Cypress, CA)",1
2007,1,5,Orioles,Y,6000000.0,Matt Wieters,C,18.3,1167.0,3994.0,146.0,0.249,0.722,4Yr,"Georgia Institute of Technology (Atlanta, GA)",0
2007,1,7,Brewers,Y,2000000.0,Matt LaPorta,1B,-1.0,291.0,967.0,31.0,0.238,0.695,4Yr,"University of Florida (Gainesville, FL)",0
2007,1,12,Marlins,Y,1800000.0,Matt Dominguez,3B,1.2,362.0,1272.0,42.0,0.231,0.644,HS,"Chatsworth Charter HS (Chatsworth, CA)",0
2007,1,13,Indians,Y,1575000.0,Beau Mills,1B,0.0,0.0,0.0,0.0,0.0,0.0,4Yr,"Lewis-Clark State College (Lewiston, ID)",1
2007,1,14,Braves,Y,1700000.0,Jason Heyward,OF,38.6,1579.0,5527.0,159.0,0.257,0.746,HS,"Henry County HS (McDonough, GA)",0
2007,1,15,Reds,Y,1400000.0,Devin Mesoraco,C,4.7,468.0,1402.0,58.0,0.232,0.715,HS,"Punxsutawney HS (Punxsutawney, PA)",0
2007,1,16,Blue Jays ,Y,1440000.0,Kevin Ahrens,3B,0.0,0.0,0.0,0.0,0.0,0.0,HS,"Memorial HS (Houston, TX)",0
2007,1,18,Cardinals,Y,1395000.0,Pete Kozma,SS,-0.5,344.0,746.0,5.0,0.213,0.564,HS,"Owasso HS (Owasso, OK)",0
2007,1,21,Blue Jays,Y,1372500.0,J.P. Arencibia,C,1.9,466.0,1573.0,80.0,0.212,0.67,4Yr,"University of Tennessee (Knoxville, TN)",0
2007,1,28,Twins,Y,750000.0,Ben Revere,OF,7.9,857.0,3138.0,7.0,0.284,0.662,HS,"Lexington Catholic HS (Lexington, KY)",0
2007,1,29,Giants ,Y,1000000.0,Wendell Fairley,OF,0.0,0.0,0.0,0.0,0.0,0.0,HS,"George County HS (Lucedale, MS)",0
2007,1,32,Giants,Y,915750.0,Nick Noonan,2B,-1.2,83.0,145.0,1.0,0.193,0.473,HS,"Parker HS (San Diego, CA)",0
2007,1,33,Braves,Y,900000.0,Jon Gilmore,3B,0.0,0.0,0.0,0.0,0.0,0.0,HS,"Iowa City HS (Iowa City, IA)",0
2007,1,34,Reds,Y,825000.0,Todd Frazier,3B,25.3,1244.0,4392.0,218.0,0.241,0.763,4Yr,"Rutgers, the State University of New Jersey (New Brunswick, NJ)",0
2007,1,35,Rangers,Y,800000.0,Julio Borbon,OF,1.7,294.0,802.0,8.0,0.273,0.665,4Yr,"University of Tennessee (Knoxville, TN)",0
2007,1,37,Phillies,Y,832500.0,Travis d'Arnaud,C,5.1,659.0,2278.0,90.0,0.251,0.736,HS,"Lakewood HS (Lakewood, CA)",1
2007,1,40,Padres,Y,765000.0,Kellen Kulbacki,OF,0.0,0.0,0.0,0.0,0.0,0.0,4Yr,"James Madison University (Harrisonburg, VA)",0
2007,1,41,Athletics,Y,742500.0,Sean Doolittle,1B,10.0,189.0,4.0,0.0,0.0,0.0,4Yr,"University of Virginia (Charlottesville, VA)",0
2007,1,43,Giants,Y,708750.0,Jackson Williams,C,0.1,14.0,24.0,1.0,0.208,0.742,4Yr,"University of Oklahoma (Norman, OK)",0
2007,1,45,Blue Jays,Y,675000.0,Justin Jackson,SS,0.0,0.0,0.0,0.0,0.0,0.0,HS,"T. C. Roberson HS (Asheville, NC)",0
2007,1,46,Padres,Y,661500.0,Drew Cumberland,SS,0.0,0.0,0.0,0.0,0.0,0.0,HS,"Pace HS (Pace, FL)",0
2007,1,48,Cubs,Y,652500.0,Josh Donaldson,C,46.2,1262.0,4600.0,257.0,0.267,0.863,4Yr,"Auburn University (Auburn, AL)",1
2007,1,49,Nationals,Y,630000.0,Michael Burgess,OF,0.0,0.0,0.0,0.0,0.0,0.0,HS,"Hillsborough HS (Tampa, FL)",0
2007,1,51,Giants,Y,607500.0,Charlie Culberson,2B,-0.4,558.0,1163.0,28.0,0.248,0.676,HS,"Calhoun HS (Calhoun, GA)",0
2007,1,52,Mariners,Y,603000.0,Matt Mangini,3B,-0.2,11.0,38.0,0.0,0.211,0.461,4Yr,"Oklahoma State University (Stillwater, OK)",0
2007,1,57,Padres,Y,552500.0,Mitch Canham,C,0.0,0.0,0.0,0.0,0.0,0.0,4Yr,"Oregon State University (Corvallis, OR)",0
2007,1,59,Athletics,Y,544500.0,Corey Brown,OF,0.4,39.0,41.0,2.0,0.171,0.635,4Yr,"Oklahoma State University (Stillwater, OK)",0
2007,1,61,Diamondbacks,Y,531000.0,Ed Easley,C,-0.1,4.0,6.0,0.0,0.0,0.0,4Yr,"Mississippi State University (Mississippi State, MS)",1
2007,1,62,Red Sox,Y,571000.0,Ryan Dent,SS,0.0,0.0,0.0,0.0,0.0,0.0,HS,"Woodrow Wilson HS (Long Beach, CA)",1
2007,1,64,Padres,Y,517500.0,Danny Payne,OF,0.0,0.0,0.0,0.0,0.0,0.0,4Yr,"Georgia Institute of Technology (Atlanta, GA)",0
2008,1,1,Rays,Y,6150000.0,Tim Beckham,SS,3.8,472.0,1614.0,63.0,0.249,0.733,HS,"Griffin HS (Griffin, GA)",1
2008,1,2,Pirates,Y,6000000.0,Pedro Alvarez,3B,5.0,910.0,2980.0,162.0,0.236,0.757,4Yr,"Vanderbilt University (Nashville, TN)",0
2008,1,3,Royals,Y,6000000.0,Eric Hosmer,1B,18.9,1628.0,6154.0,194.0,0.277,0.765,HS,"American Heritage HS (Plantation, FL)",0
2008,1,5,Giants,Y,6200000.0,Buster Posey,C,44.8,1371.0,4970.0,158.0,0.302,0.831,4Yr,"Florida State University (Tallahassee, FL)",0
2008,1,6,Marlins,Y,2300000.0,Kyle Skipworth,C,-0.1,4.0,3.0,0.0,0.0,0.25,HS,"Patriot HS (Jurupa Valley, CA)",0
2008,1,7,Reds,Y,2000000.0,Yonder Alonso,1B,8.1,1072.0,3362.0,100.0,0.259,0.736,4Yr,"University of Miami (Coral Gables, FL)",0
2008,1,8,White Sox,Y,2600000.0,Gordon Beckham,SS,5.5,1069.0,3403.0,80.0,0.237,0.667,4Yr,"University of Georgia (Athens, GA)",1
2008,1,10,Astros,Y,2070000.0,Jason Castro,C,12.5,952.0,2981.0,97.0,0.227,0.699,4Yr,"Stanford University (Palo Alto, CA)",0
2008,1,11,Rangers,Y,3500000.0,Justin Smoak,1B,6.9,1286.0,4153.0,196.0,0.229,0.74,4Yr,"University of South Carolina (Columbia, SC)",0
2008,1,12,Athletics,Y,1910000.0,Jemile Weeks,2B,1.5,260.0,955.0,4.0,0.255,0.667,4Yr,"University of Miami (Coral Gables, FL)",0
2008,1,13,Cardinals,Y,1840000.0,Brett Wallace,1B,-0.2,494.0,1284.0,40.0,0.238,0.705,4Yr,"Arizona State University (Tempe, AZ)",0
2008,1,14,Twins,Y,1780000.0,Aaron Hicks,OF,12.9,811.0,2635.0,96.0,0.233,0.724,HS,"Woodrow Wilson HS (Long Beach, CA)",0
2008,1,16,Brewers,Y,1700000.0,Brett Lawrie,3B,15.6,588.0,2217.0,71.0,0.261,0.734,HS,"Brookswood SS (Langley, BC)",1
2008,1,17,Blue Jays,Y,1500000.0,David Cooper,1B,0.1,72.0,211.0,6.0,0.27,0.751,4Yr,"University of California, Berkeley (Berkeley, CA)",0
2008,1,18,Mets ,Y,1575000.0,Ike Davis,1B,5.8,665.0,2076.0,81.0,0.239,0.746,4Yr,"Arizona State University (Tempe, AZ)",0
2008,1,22,Mets,Y,1419000.0,Reese Havens,SS,0.0,0.0,0.0,0.0,0.0,0.0,4Yr,"University of South Carolina (Columbia, SC)",0
2008,1,23,Padres,Y,1150000.0,Allan Dykstra,1B,-0.5,13.0,31.0,1.0,0.129,0.515,4Yr,"Wake Forest University (Winston-Salem, NC)",0
2008,1,24,Phillies,Y,1380000.0,Anthony Hewitt,SS,0.0,0.0,0.0,0.0,0.0,0.0,HS,"Salisbury Prep (Salisbury, CT)",1
2008,1,29,Indians,Y,1100000.0,Lonnie Chisenhall,3B,9.0,688.0,2159.0,64.0,0.268,0.747,JC,"Pitt Community College (Winterville, NC)",0
2008,1,30,Red Sox,Y,3000000.0,Casey Kelly,SS,-1.4,27.0,18.0,0.0,0.111,0.222,HS,"Sarasota HS (Sarasota, FL)",1
2008,1,34,Phillies,Y,1020000.0,Zach Collier,OF,0.0,0.0,0.0,0.0,0.0,0.0,HS,"Chino Hills HS (Chino Hills, CA)",1
2008,1,37,Giants,Y,970000.0,Conor Gillaspie,3B,2.2,513.0,1424.0,33.0,0.251,0.695,4Yr,"Wichita State University (Wichita, KS)",0
2008,1,41,Cubs,Y,906000.0,Ryan Flaherty,SS,1.1,547.0,1324.0,37.0,0.215,0.629,4Yr,"Vanderbilt University (Nashville, TN)",1
2008,1,42,Padres,Y,892000.0,Jaff Decker,OF,-1.5,77.0,161.0,1.0,0.174,0.51,HS,"Sunrise Mountain HS (Peoria, AZ)",0
2008,1,46,Padres,Y,835000.0,Logan Forsythe,3B,12.1,970.0,3120.0,71.0,0.244,0.695,4Yr,"University of Arkansas (Fayetteville, AR)",0
2009,1,2,Mariners,Y,6000000.0,Dustin Ackley,CF,7.7,635.0,2125.0,46.0,0.241,0.672,4Yr,"University of North Carolina at Chapel Hill (Chapel Hill, NC)",0
2009,1,3,Padres,Y,6250000.0,Donavan Tate,CF,0.0,0.0,0.0,0.0,0.0,0.0,HS,"Cartersville HS (Cartersville, GA)",0
2009,1,4,Pirates,Y,2500000.0,Tony Sanchez,C,0.1,52.0,144.0,4.0,0.257,0.676,4Yr,"Boston College (Chestnut Hill, MA)",0
2009,1,13,Athletics,Y,2750000.0,Grant Green,SS,-1.7,129.0,330.0,4.0,0.249,0.62,4Yr,"University of Southern California (Los Angeles, CA)",0
2009,1,16,Diamondbacks,Y,1800000.0,Bobby Borchering,3B,0.0,0.0,0.0,0.0,0.0,0.0,HS,"Bishop Verot HS (Fort Myers, FL)",0
2009,1,17,Diamondbacks ,Y,1400000.0,AJ Pollock,CF,22.8,959.0,3388.0,130.0,0.279,0.808,4Yr,"University of Notre Dame (South Bend, IN)",0
2009,1,21,Astros,Y,1358000.0,Jiovanni Mier,SS,0.0,0.0,0.0,0.0,0.0,0.0,HS,"Bonita HS (La Verne, CA)",0
2009,1,23,White Sox,Y,1200000.0,Jared Mitchell,CF,0.0,0.0,0.0,0.0,0.0,0.0,4Yr,"Louisiana State University (Baton Rouge, LA)",0
2009,1,24,Angels ,Y,1242000.0,Randal Grichuk,LF,10.5,951.0,3270.0,164.0,0.246,0.758,HS,"Lamar Consolidated HS (Rosenberg, TX)",1
2009,1,25,Angels ,Y,1215000.0,Mike Trout,CF,79.8,1362.0,4920.0,333.0,0.303,1.001,HS,"Millville Senior HS (Millville, NJ)",1
2009,1,27,Mariners ,Y,1280000.0,Nick Franklin,SS,1.2,301.0,833.0,24.0,0.214,0.644,HS,"Lake Brantley HS (Altamonte Springs, FL)",0
2009,1,28,Red Sox,Y,1134000.0,Rey Fuentes,CF,-0.6,100.0,210.0,3.0,0.238,0.595,HS,"Fernando Callejo HS (Manati, Puerto Rico)",1
2009,1,29,Yankees,Y,2200000.0,Slade Heathcott,CF,0.4,17.0,25.0,2.0,0.4,1.149,HS,"Texas HS (Texarkana, TX)",1
2009,1,30,Rays,N,0.0,LeVon Washington,2B,0.0,0.0,0.0,0.0,0.0,0.0,HS,"F. W. Buchholz HS (Gainesville, FL)",0
2009,1,31,Cubs,Y,972000.0,Brett Jackson,CF,0.0,51.0,124.0,4.0,0.169,0.63,4Yr,"University of California, Berkeley (Berkeley, CA)",0
2009,1,32,Rockies ,Y,900000.0,Tim Wheeler,CF,0.0,0.0,0.0,0.0,0.0,0.0,4Yr,"California State University, Sacramento (Sacramento, CA)",1
2009,1,33,Mariners,Y,980000.0,Steven Baron,C,-0.4,13.0,26.0,0.0,0.115,0.269,HS,"John A. Ferguson School (Miami, FL)",0
2009,1,35,Diamondbacks,Y,900000.0,Matt Davidson,3B,-0.7,306.0,1003.0,54.0,0.22,0.719,HS,"Yucaipa HS (Yucaipa, CA)",0
2009,1,38,White Sox,Y,858600.0,Josh Phegley,C,2.1,387.0,1116.0,35.0,0.225,0.649,4Yr,"Indiana University Bloomington (Bloomington, IN)",0
2009,1,39,Brewers,Y,1200000.0,Kentrail Davis,CF,0.0,0.0,0.0,0.0,0.0,0.0,4Yr,"University of Tennessee (Knoxville, TN)",0
2009,1,41,Diamondbacks,Y,950000.0,Chris Owings,SS,2.3,710.0,2280.0,37.0,0.24,0.653,HS,"Gilbert HS (Gilbert, SC)",0
2010,1,1,Nationals,Y,6250000.0,Bryce Harper,OF,42.7,1347.0,4799.0,282.0,0.281,0.919,JC,"College of Southern Nevada (Henderson, NV)",0
